20:18:36.042569 IP 10.244.2.3.59416 > 10.96.0.10.53: 49442+ A? example.com.default.svc.cluster.local. (55)
20:18:36.042653 IP 10.244.2.3.59416 > 10.96.0.10.53: 51942+ AAAA? example.com.default.svc.cluster.local. (55)
20:18:36.044217 IP 10.96.0.10.53 > 10.244.2.3.59416: 49442 NXDomain*- 0/1/0 (148)
20:18:36.044319 IP 10.96.0.10.53 > 10.244.2.3.59416: 51942 NXDomain*- 0/1/0 (148)
20:18:36.044509 IP 10.244.2.3.57347 > 10.96.0.10.53: 34761+ A? example.com.svc.cluster.local. (47)
20:18:36.044643 IP 10.244.2.3.57347 > 10.96.0.10.53: 37177+ AAAA? example.com.svc.cluster.local. (47)
20:18:36.044895 IP 10.96.0.10.53 > 10.244.2.3.57347: 37177 NXDomain*- 0/1/0 (140)
20:18:36.044957 IP 10.96.0.10.53 > 10.244.2.3.57347: 34761 NXDomain*- 0/1/0 (140)
20:18:36.045157 IP 10.244.2.3.40359 > 10.96.0.10.53: 31584+ A? example.com.cluster.local. (43)
20:18:36.045265 IP 10.244.2.3.40359 > 10.96.0.10.53: 33876+ AAAA? example.com.cluster.local. (43)
20:18:36.045477 IP 10.96.0.10.53 > 10.244.2.3.40359: 33876 NXDomain*- 0/1/0 (136)
20:18:36.045553 IP 10.96.0.10.53 > 10.244.2.3.40359: 31584 NXDomain*- 0/1/0 (136)
20:18:36.045624 IP 10.244.2.3.55059 > 10.96.0.10.53: 59047+ A? example.com.iitr.ac.in. (40)
20:18:36.045706 IP 10.244.2.3.55059 > 10.96.0.10.53: 61256+ AAAA? example.com.iitr.ac.in. (40)
20:18:36.048850 IP 10.96.0.10.53 > 10.244.2.3.55059: 61256 0/1/0 (128)
20:18:36.048932 IP 10.96.0.10.53 > 10.244.2.3.55059: 59047 0/1/0 (128)
20:18:37.065556 IP 10.244.2.3.40579 > 10.96.0.10.53: 61026+ A? example.com.default.svc.cluster.local. (55)
20:18:37.065822 IP 10.244.2.3.40579 > 10.96.0.10.53: 62401+ AAAA? example.com.default.svc.cluster.local. (55)
20:18:37.066733 IP 10.96.0.10.53 > 10.244.2.3.40579: 61026 NXDomain*- 0/1/0 (148)
20:18:37.067087 IP 10.96.0.10.53 > 10.244.2.3.40579: 62401 NXDomain*- 0/1/0 (148)
20:18:37.067225 IP 10.244.2.3.32916 > 10.96.0.10.53: 63741+ A? example.com.svc.cluster.local. (47)
20:18:37.067294 IP 10.244.2.3.32916 > 10.96.0.10.53: 747+ AAAA? example.com.svc.cluster.local. (47)
20:18:37.068660 IP 10.96.0.10.53 > 10.244.2.3.32916: 63741 NXDomain*- 0/1/0 (140)
20:18:37.070940 IP 10.96.0.10.53 > 10.244.2.3.32916: 747 NXDomain*- 0/1/0 (140)
20:18:37.071169 IP 10.244.2.3.59902 > 10.96.0.10.53: 27023+ A? example.com.cluster.local. (43)
20:18:37.071221 IP 10.244.2.3.59902 > 10.96.0.10.53: 28481+ AAAA? example.com.cluster.local. (43)
20:18:37.071788 IP 10.96.0.10.53 > 10.244.2.3.59902: 28481 NXDomain*- 0/1/0 (136)
20:18:37.071855 IP 10.96.0.10.53 > 10.244.2.3.59902: 27023 NXDomain*- 0/1/0 (136)
20:18:37.071888 IP 10.244.2.3.57800 > 10.96.0.10.53: 40930+ A? example.com.iitr.ac.in. (40)
20:18:37.071990 IP 10.244.2.3.57800 > 10.96.0.10.53: 42596+ AAAA? example.com.iitr.ac.in. (40)
20:18:37.072479 IP 10.96.0.10.53 > 10.244.2.3.57800: 42596* 0/1/0 (128)
20:18:37.072588 IP 10.96.0.10.53 > 10.244.2.3.57800: 40930* 0/1/0 (128)
20:18:38.079068 IP 10.244.2.3.46186 > 10.96.0.10.53: 22358+ A? example.com.default.svc.cluster.local. (55)
20:18:38.079221 IP 10.244.2.3.46186 > 10.96.0.10.53: 23942+ AAAA? example.com.default.svc.cluster.local. (55)
20:18:38.079507 IP 10.96.0.10.53 > 10.244.2.3.46186: 22358 NXDomain*- 0/1/0 (148)
20:18:38.082763 IP 10.96.0.10.53 > 10.244.2.3.46186: 23942 NXDomain*- 0/1/0 (148)
20:18:38.082880 IP 10.244.2.3.57929 > 10.96.0.10.53: 13550+ A? example.com.svc.cluster.local. (47)
20:18:38.082936 IP 10.244.2.3.57929 > 10.96.0.10.53: 16008+ AAAA? example.com.svc.cluster.local. (47)
20:18:38.083175 IP 10.96.0.10.53 > 10.244.2.3.57929: 16008 NXDomain*- 0/1/0 (140)
20:18:38.083280 IP 10.96.0.10.53 > 10.244.2.3.57929: 13550 NXDomain*- 0/1/0 (140)
20:18:38.083328 IP 10.244.2.3.46187 > 10.96.0.10.53: 16472+ A? example.com.cluster.local. (43)
20:18:38.083406 IP 10.244.2.3.46187 > 10.96.0.10.53: 17763+ AAAA? example.com.cluster.local. (43)
20:18:38.088442 IP 10.96.0.10.53 > 10.244.2.3.46187: 16472 NXDomain*- 0/1/0 (136)
20:18:38.090144 IP 10.96.0.10.53 > 10.244.2.3.46187: 17763 NXDomain*- 0/1/0 (136)
20:18:38.090310 IP 10.244.2.3.53887 > 10.96.0.10.53: 16387+ A? example.com.iitr.ac.in. (40)
20:18:38.090390 IP 10.244.2.3.53887 > 10.96.0.10.53: 17637+ AAAA? example.com.iitr.ac.in. (40)
20:18:38.090571 IP 10.96.0.10.53 > 10.244.2.3.53887: 17637* 0/1/0 (128)
20:18:38.090657 IP 10.96.0.10.53 > 10.244.2.3.53887: 16387* 0/1/0 (128)
20:18:39.097127 IP 10.244.2.3.56626 > 10.96.0.10.53: 34414+ A? example.com.default.svc.cluster.local. (55)
20:18:39.097332 IP 10.244.2.3.56626 > 10.96.0.10.53: 35914+ AAAA? example.com.default.svc.cluster.local. (55)
20:18:39.097642 IP 10.96.0.10.53 > 10.244.2.3.56626: 35914 NXDomain*- 0/1/0 (148)
20:18:39.097736 IP 10.96.0.10.53 > 10.244.2.3.56626: 34414 NXDomain*- 0/1/0 (148)
20:18:39.097771 IP 10.244.2.3.50406 > 10.96.0.10.53: 38397+ A? example.com.svc.cluster.local. (47)
20:18:39.097856 IP 10.244.2.3.50406 > 10.96.0.10.53: 39939+ AAAA? example.com.svc.cluster.local. (47)
20:18:39.098059 IP 10.96.0.10.53 > 10.244.2.3.50406: 39939 NXDomain*- 0/1/0 (140)
20:18:39.098124 IP 10.96.0.10.53 > 10.244.2.3.50406: 38397 NXDomain*- 0/1/0 (140)
20:18:39.098174 IP 10.244.2.3.37277 > 10.96.0.10.53: 53104+ A? example.com.cluster.local. (43)
20:18:39.098236 IP 10.244.2.3.37277 > 10.96.0.10.53: 54479+ AAAA? example.com.cluster.local. (43)
20:18:39.098346 IP 10.96.0.10.53 > 10.244.2.3.37277: 54479 NXDomain*- 0/1/0 (136)
20:18:39.098383 IP 10.96.0.10.53 > 10.244.2.3.37277: 53104 NXDomain*- 0/1/0 (136)
20:18:39.098430 IP 10.244.2.3.36091 > 10.96.0.10.53: 49089+ A? example.com.iitr.ac.in. (40)
20:18:39.098488 IP 10.244.2.3.36091 > 10.96.0.10.53: 50422+ AAAA? example.com.iitr.ac.in. (40)
20:18:39.098597 IP 10.96.0.10.53 > 10.244.2.3.36091: 49089* 0/1/0 (128)
20:18:39.098637 IP 10.96.0.10.53 > 10.244.2.3.36091: 50422* 0/1/0 (128)
20:18:40.104424 IP 10.244.2.3.58689 > 10.96.0.10.53: 50446+ A? example.com.default.svc.cluster.local. (55)
20:18:40.104534 IP 10.244.2.3.58689 > 10.96.0.10.53: 51738+ AAAA? example.com.default.svc.cluster.local. (55)
20:18:40.104843 IP 10.96.0.10.53 > 10.244.2.3.58689: 50446 NXDomain*- 0/1/0 (148)
20:18:40.106263 IP 10.96.0.10.53 > 10.244.2.3.58689: 51738 NXDomain*- 0/1/0 (148)
20:18:40.106417 IP 10.244.2.3.34256 > 10.96.0.10.53: 38278+ A? example.com.svc.cluster.local. (47)
20:18:40.106470 IP 10.244.2.3.34256 > 10.96.0.10.53: 39528+ AAAA? example.com.svc.cluster.local. (47)
20:18:40.106607 IP 10.96.0.10.53 > 10.244.2.3.34256: 39528 NXDomain*- 0/1/0 (140)
20:18:40.106719 IP 10.96.0.10.53 > 10.244.2.3.34256: 38278 NXDomain*- 0/1/0 (140)
20:18:40.106784 IP 10.244.2.3.45905 > 10.96.0.10.53: 14776+ A? example.com.cluster.local. (43)
20:18:40.106854 IP 10.244.2.3.45905 > 10.96.0.10.53: 15984+ AAAA? example.com.cluster.local. (43)
20:18:40.107013 IP 10.96.0.10.53 > 10.244.2.3.45905: 15984 NXDomain*- 0/1/0 (136)
20:18:40.107171 IP 10.96.0.10.53 > 10.244.2.3.45905: 14776 NXDomain*- 0/1/0 (136)
20:18:40.107223 IP 10.244.2.3.48399 > 10.96.0.10.53: 64274+ A? example.com.iitr.ac.in. (40)
20:18:40.107277 IP 10.244.2.3.48399 > 10.96.0.10.53: 65483+ AAAA? example.com.iitr.ac.in. (40)
20:18:40.107608 IP 10.96.0.10.53 > 10.244.2.3.48399: 65483* 0/1/0 (128)
20:18:40.107709 IP 10.96.0.10.53 > 10.244.2.3.48399: 64274* 0/1/0 (128)
20:18:41.117702 IP 10.244.2.3.60467 > 10.96.0.10.53: 63210+ A? example.com.default.svc.cluster.local. (55)
20:18:41.118125 IP 10.244.2.3.60467 > 10.96.0.10.53: 64793+ AAAA? example.com.default.svc.cluster.local. (55)
20:18:41.118696 IP 10.96.0.10.53 > 10.244.2.3.60467: 64793 NXDomain*- 0/1/0 (148)
20:18:41.120709 IP 10.96.0.10.53 > 10.244.2.3.60467: 63210 NXDomain*- 0/1/0 (148)
20:18:41.120891 IP 10.244.2.3.43470 > 10.96.0.10.53: 10127+ A? example.com.svc.cluster.local. (47)
20:18:41.121000 IP 10.244.2.3.43470 > 10.96.0.10.53: 11418+ AAAA? example.com.svc.cluster.local. (47)
20:18:41.121191 IP 10.96.0.10.53 > 10.244.2.3.43470: 10127 NXDomain*- 0/1/0 (140)
20:18:41.121245 IP 10.96.0.10.53 > 10.244.2.3.43470: 11418 NXDomain*- 0/1/0 (140)
20:18:41.121339 IP 10.244.2.3.54866 > 10.96.0.10.53: 9673+ A? example.com.cluster.local. (43)
20:18:41.121429 IP 10.244.2.3.54866 > 10.96.0.10.53: 11007+ AAAA? example.com.cluster.local. (43)
20:18:41.121628 IP 10.96.0.10.53 > 10.244.2.3.54866: 9673 NXDomain*- 0/1/0 (136)
20:18:41.121721 IP 10.96.0.10.53 > 10.244.2.3.54866: 11007 NXDomain*- 0/1/0 (136)
20:18:41.121772 IP 10.244.2.3.54231 > 10.96.0.10.53: 64963+ A? example.com.iitr.ac.in. (40)
20:18:41.121812 IP 10.244.2.3.54231 > 10.96.0.10.53: 552+ AAAA? example.com.iitr.ac.in. (40)
20:18:41.121925 IP 10.96.0.10.53 > 10.244.2.3.54231: 552* 0/1/0 (128)
20:18:41.122038 IP 10.96.0.10.53 > 10.244.2.3.54231: 64963* 0/1/0 (128)
20:18:42.130865 IP 10.244.2.3.33590 > 10.96.0.10.53: 26925+ A? example.com.default.svc.cluster.local. (55)
20:18:42.131262 IP 10.244.2.3.33590 > 10.96.0.10.53: 28259+ AAAA? example.com.default.svc.cluster.local. (55)
20:18:42.131930 IP 10.96.0.10.53 > 10.244.2.3.33590: 28259 NXDomain*- 0/1/0 (148)
20:18:42.132151 IP 10.96.0.10.53 > 10.244.2.3.33590: 26925 NXDomain*- 0/1/0 (148)
20:18:42.132279 IP 10.244.2.3.45665 > 10.96.0.10.53: 44989+ A? example.com.svc.cluster.local. (47)
20:18:42.132369 IP 10.244.2.3.45665 > 10.96.0.10.53: 46447+ AAAA? example.com.svc.cluster.local. (47)
20:18:42.132733 IP 10.96.0.10.53 > 10.244.2.3.45665: 44989 NXDomain*- 0/1/0 (140)
20:18:42.132904 IP 10.96.0.10.53 > 10.244.2.3.45665: 46447 NXDomain*- 0/1/0 (140)
20:18:42.132993 IP 10.244.2.3.33351 > 10.96.0.10.53: 11777+ A? example.com.cluster.local. (43)
20:18:42.133042 IP 10.244.2.3.33351 > 10.96.0.10.53: 13027+ AAAA? example.com.cluster.local. (43)
20:18:42.133149 IP 10.96.0.10.53 > 10.244.2.3.33351: 11777 NXDomain*- 0/1/0 (136)
20:18:42.133193 IP 10.96.0.10.53 > 10.244.2.3.33351: 13027 NXDomain*- 0/1/0 (136)
20:18:42.133292 IP 10.244.2.3.51370 > 10.96.0.10.53: 28012+ A? example.com.iitr.ac.in. (40)
20:18:42.133334 IP 10.244.2.3.51370 > 10.96.0.10.53: 29304+ AAAA? example.com.iitr.ac.in. (40)
20:18:42.133662 IP 10.96.0.10.53 > 10.244.2.3.51370: 29304* 0/1/0 (128)
20:18:42.135763 IP 10.96.0.10.53 > 10.244.2.3.51370: 28012* 0/1/0 (128)
20:18:43.140304 IP 10.244.2.3.50247 > 10.96.0.10.53: 57386+ A? example.com.default.svc.cluster.local. (55)
20:18:43.140529 IP 10.244.2.3.50247 > 10.96.0.10.53: 58719+ AAAA? example.com.default.svc.cluster.local. (55)
20:18:43.140874 IP 10.96.0.10.53 > 10.244.2.3.50247: 58719 NXDomain*- 0/1/0 (148)
20:18:43.140947 IP 10.96.0.10.53 > 10.244.2.3.50247: 57386 NXDomain*- 0/1/0 (148)
20:18:43.141192 IP 10.244.2.3.48256 > 10.96.0.10.53: 5902+ A? example.com.svc.cluster.local. (47)
20:18:43.141243 IP 10.244.2.3.48256 > 10.96.0.10.53: 7611+ AAAA? example.com.svc.cluster.local. (47)
20:18:43.141692 IP 10.96.0.10.53 > 10.244.2.3.48256: 7611 NXDomain*- 0/1/0 (140)
20:18:43.141796 IP 10.96.0.10.53 > 10.244.2.3.48256: 5902 NXDomain*- 0/1/0 (140)
20:18:43.141850 IP 10.244.2.3.50975 > 10.96.0.10.53: 10677+ A? example.com.cluster.local. (43)
20:18:43.141883 IP 10.244.2.3.50975 > 10.96.0.10.53: 11886+ AAAA? example.com.cluster.local. (43)
20:18:43.142017 IP 10.96.0.10.53 > 10.244.2.3.50975: 11886 NXDomain*- 0/1/0 (136)
20:18:43.142149 IP 10.96.0.10.53 > 10.244.2.3.50975: 10677 NXDomain*- 0/1/0 (136)
20:18:43.142193 IP 10.244.2.3.47312 > 10.96.0.10.53: 36169+ A? example.com.iitr.ac.in. (40)
20:18:43.142248 IP 10.244.2.3.47312 > 10.96.0.10.53: 37919+ AAAA? example.com.iitr.ac.in. (40)
20:18:43.142347 IP 10.96.0.10.53 > 10.244.2.3.47312: 37919* 0/1/0 (128)
20:18:43.142376 IP 10.96.0.10.53 > 10.244.2.3.47312: 36169* 0/1/0 (128)
20:18:44.147772 IP 10.244.2.3.58039 > 10.96.0.10.53: 20195+ A? example.com.default.svc.cluster.local. (55)
20:18:44.147920 IP 10.244.2.3.58039 > 10.96.0.10.53: 21528+ AAAA? example.com.default.svc.cluster.local. (55)
20:18:44.148257 IP 10.96.0.10.53 > 10.244.2.3.58039: 20195 NXDomain*- 0/1/0 (148)
20:18:44.148333 IP 10.96.0.10.53 > 10.244.2.3.58039: 21528 NXDomain*- 0/1/0 (148)
20:18:44.148383 IP 10.244.2.3.52858 > 10.96.0.10.53: 59380+ A? example.com.svc.cluster.local. (47)
20:18:44.148461 IP 10.244.2.3.52858 > 10.96.0.10.53: 60630+ AAAA? example.com.svc.cluster.local. (47)
20:18:44.148658 IP 10.96.0.10.53 > 10.244.2.3.52858: 60630 NXDomain*- 0/1/0 (140)
20:18:44.148713 IP 10.96.0.10.53 > 10.244.2.3.52858: 59380 NXDomain*- 0/1/0 (140)
20:18:44.148752 IP 10.244.2.3.36396 > 10.96.0.10.53: 41128+ A? example.com.cluster.local. (43)
20:18:44.148823 IP 10.244.2.3.36396 > 10.96.0.10.53: 42253+ AAAA? example.com.cluster.local. (43)
20:18:44.149022 IP 10.96.0.10.53 > 10.244.2.3.36396: 42253 NXDomain*- 0/1/0 (136)
20:18:44.149070 IP 10.96.0.10.53 > 10.244.2.3.36396: 41128 NXDomain*- 0/1/0 (136)
20:18:44.149125 IP 10.244.2.3.40406 > 10.96.0.10.53: 16751+ A? example.com.iitr.ac.in. (40)
20:18:44.149171 IP 10.244.2.3.40406 > 10.96.0.10.53: 18501+ AAAA? example.com.iitr.ac.in. (40)
20:18:44.149293 IP 10.96.0.10.53 > 10.244.2.3.40406: 18501* 0/1/0 (128)
20:18:44.149359 IP 10.96.0.10.53 > 10.244.2.3.40406: 16751* 0/1/0 (128)
20:18:44.433070 ARP, Request who-has 10.244.2.1 tell 10.244.2.3, length 28
20:18:44.433606 ARP, Reply 10.244.2.1 is-at 16:e4:c0:1f:97:55, length 28
20:18:45.157183 IP 10.244.2.3.53507 > 10.96.0.10.53: 34940+ A? example.com.default.svc.cluster.local. (55)
20:18:45.157257 IP 10.244.2.3.53507 > 10.96.0.10.53: 36357+ AAAA? example.com.default.svc.cluster.local. (55)
20:18:45.159110 IP 10.96.0.10.53 > 10.244.2.3.53507: 34940 NXDomain*- 0/1/0 (148)
20:18:45.163025 IP 10.96.0.10.53 > 10.244.2.3.53507: 36357 NXDomain*- 0/1/0 (148)
20:18:45.163380 IP 10.244.2.3.59614 > 10.96.0.10.53: 38275+ A? example.com.svc.cluster.local. (47)
20:18:45.163553 IP 10.244.2.3.59614 > 10.96.0.10.53: 41733+ AAAA? example.com.svc.cluster.local. (47)
20:18:45.163927 IP 10.96.0.10.53 > 10.244.2.3.59614: 41733 NXDomain*- 0/1/0 (140)
20:18:45.164179 IP 10.96.0.10.53 > 10.244.2.3.59614: 38275 NXDomain*- 0/1/0 (140)
20:18:45.164524 IP 10.244.2.3.56892 > 10.96.0.10.53: 54222+ A? example.com.cluster.local. (43)
20:18:45.164607 IP 10.244.2.3.56892 > 10.96.0.10.53: 57513+ AAAA? example.com.cluster.local. (43)
20:18:45.165115 IP 10.96.0.10.53 > 10.244.2.3.56892: 57513 NXDomain*- 0/1/0 (136)
20:18:45.165452 IP 10.96.0.10.53 > 10.244.2.3.56892: 54222 NXDomain*- 0/1/0 (136)
20:18:45.165783 IP 10.244.2.3.50013 > 10.96.0.10.53: 7223+ A? example.com.iitr.ac.in. (40)
20:18:45.166568 IP 10.96.0.10.53 > 10.244.2.3.50013: 7223* 0/1/0 (128)
20:18:45.166684 IP 10.244.2.3.50013 > 10.96.0.10.53: 1361+ AAAA? example.com.iitr.ac.in. (40)
20:18:45.167099 IP 10.96.0.10.53 > 10.244.2.3.50013: 1361* 0/1/0 (128)
20:18:46.176580 IP 10.244.2.3.49319 > 10.96.0.10.53: 33289+ A? example.com.default.svc.cluster.local. (55)
20:18:46.176812 IP 10.244.2.3.49319 > 10.96.0.10.53: 34706+ AAAA? example.com.default.svc.cluster.local. (55)
20:18:46.177492 IP 10.96.0.10.53 > 10.244.2.3.49319: 34706 NXDomain*- 0/1/0 (148)
20:18:46.177581 IP 10.96.0.10.53 > 10.244.2.3.49319: 33289 NXDomain*- 0/1/0 (148)
20:18:46.177619 IP 10.244.2.3.44582 > 10.96.0.10.53: 1735+ A? example.com.svc.cluster.local. (47)
20:18:46.177693 IP 10.244.2.3.44582 > 10.96.0.10.53: 3444+ AAAA? example.com.svc.cluster.local. (47)
20:18:46.177868 IP 10.96.0.10.53 > 10.244.2.3.44582: 3444 NXDomain*- 0/1/0 (140)
20:18:46.178057 IP 10.96.0.10.53 > 10.244.2.3.44582: 1735 NXDomain*- 0/1/0 (140)
20:18:46.178136 IP 10.244.2.3.39089 > 10.96.0.10.53: 62324+ A? example.com.cluster.local. (43)
20:18:46.178235 IP 10.244.2.3.39089 > 10.96.0.10.53: 63699+ AAAA? example.com.cluster.local. (43)
20:18:46.178507 IP 10.96.0.10.53 > 10.244.2.3.39089: 62324 NXDomain*- 0/1/0 (136)
20:18:46.180160 IP 10.96.0.10.53 > 10.244.2.3.39089: 63699 NXDomain*- 0/1/0 (136)
20:18:46.180239 IP 10.244.2.3.42037 > 10.96.0.10.53: 58412+ A? example.com.iitr.ac.in. (40)
20:18:46.180269 IP 10.244.2.3.42037 > 10.96.0.10.53: 60371+ AAAA? example.com.iitr.ac.in. (40)
20:18:46.180847 IP 10.96.0.10.53 > 10.244.2.3.42037: 60371* 0/1/0 (128)
20:18:46.180888 IP 10.96.0.10.53 > 10.244.2.3.42037: 58412* 0/1/0 (128)
20:18:47.188328 IP 10.244.2.3.39047 > 10.96.0.10.53: 7489+ A? example.com.default.svc.cluster.local. (55)
20:18:47.188496 IP 10.244.2.3.39047 > 10.96.0.10.53: 8864+ AAAA? example.com.default.svc.cluster.local. (55)
20:18:47.188859 IP 10.96.0.10.53 > 10.244.2.3.39047: 8864 NXDomain*- 0/1/0 (148)
20:18:47.188959 IP 10.96.0.10.53 > 10.244.2.3.39047: 7489 NXDomain*- 0/1/0 (148)
20:18:47.189205 IP 10.244.2.3.58905 > 10.96.0.10.53: 57659+ A? example.com.svc.cluster.local. (47)
20:18:47.189263 IP 10.244.2.3.58905 > 10.96.0.10.53: 59034+ AAAA? example.com.svc.cluster.local. (47)
20:18:47.189455 IP 10.96.0.10.53 > 10.244.2.3.58905: 59034 NXDomain*- 0/1/0 (140)
20:18:47.189507 IP 10.96.0.10.53 > 10.244.2.3.58905: 57659 NXDomain*- 0/1/0 (140)
20:18:47.189587 IP 10.244.2.3.45524 > 10.96.0.10.53: 44574+ A? example.com.cluster.local. (43)
20:18:47.189650 IP 10.244.2.3.45524 > 10.96.0.10.53: 45908+ AAAA? example.com.cluster.local. (43)
20:18:47.189894 IP 10.96.0.10.53 > 10.244.2.3.45524: 45908 NXDomain*- 0/1/0 (136)
20:18:47.189950 IP 10.96.0.10.53 > 10.244.2.3.45524: 44574 NXDomain*- 0/1/0 (136)
20:18:47.190210 IP 10.244.2.3.49152 > 10.96.0.10.53: 17058+ A? example.com.iitr.ac.in. (40)
20:18:47.190257 IP 10.244.2.3.49152 > 10.96.0.10.53: 18308+ AAAA? example.com.iitr.ac.in. (40)
20:18:47.190560 IP 10.96.0.10.53 > 10.244.2.3.49152: 18308* 0/1/0 (128)
20:18:47.190795 IP 10.96.0.10.53 > 10.244.2.3.49152: 17058* 0/1/0 (128)
20:18:48.204620 IP 10.244.2.3.42290 > 10.96.0.10.53: 55595+ A? example.com.default.svc.cluster.local. (55)
20:18:48.204947 IP 10.244.2.3.42290 > 10.96.0.10.53: 60387+ AAAA? example.com.default.svc.cluster.local. (55)
20:18:48.205634 IP 10.96.0.10.53 > 10.244.2.3.42290: 60387 NXDomain*- 0/1/0 (148)
20:18:48.205843 IP 10.96.0.10.53 > 10.244.2.3.42290: 55595 NXDomain*- 0/1/0 (148)
20:18:48.206106 IP 10.244.2.3.51991 > 10.96.0.10.53: 32617+ A? example.com.svc.cluster.local. (47)
20:18:48.206265 IP 10.244.2.3.51991 > 10.96.0.10.53: 36617+ AAAA? example.com.svc.cluster.local. (47)
20:18:48.206751 IP 10.96.0.10.53 > 10.244.2.3.51991: 36617 NXDomain*- 0/1/0 (140)
20:18:48.210139 IP 10.96.0.10.53 > 10.244.2.3.51991: 32617 NXDomain*- 0/1/0 (140)
20:18:48.210491 IP 10.244.2.3.39113 > 10.96.0.10.53: 36070+ A? example.com.cluster.local. (43)
20:18:48.210668 IP 10.244.2.3.39113 > 10.96.0.10.53: 39445+ AAAA? example.com.cluster.local. (43)
20:18:48.211140 IP 10.96.0.10.53 > 10.244.2.3.39113: 39445 NXDomain*- 0/1/0 (136)
20:18:48.212948 IP 10.96.0.10.53 > 10.244.2.3.39113: 36070 NXDomain*- 0/1/0 (136)
20:18:48.213258 IP 10.244.2.3.40283 > 10.96.0.10.53: 27100+ A? example.com.iitr.ac.in. (40)
20:18:48.213487 IP 10.244.2.3.40283 > 10.96.0.10.53: 30142+ AAAA? example.com.iitr.ac.in. (40)
20:18:48.213856 IP 10.96.0.10.53 > 10.244.2.3.40283: 30142* 0/1/0 (128)
20:18:48.214057 IP 10.96.0.10.53 > 10.244.2.3.40283: 27100* 0/1/0 (128)
20:18:49.224417 IP 10.244.2.3.46571 > 10.96.0.10.53: 8657+ A? example.com.default.svc.cluster.local. (55)
20:18:49.224661 IP 10.244.2.3.46571 > 10.96.0.10.53: 11282+ AAAA? example.com.default.svc.cluster.local. (55)
20:18:49.225150 IP 10.96.0.10.53 > 10.244.2.3.46571: 11282 NXDomain*- 0/1/0 (148)
20:18:49.225256 IP 10.96.0.10.53 > 10.244.2.3.46571: 8657 NXDomain*- 0/1/0 (148)
20:18:49.225343 IP 10.244.2.3.60309 > 10.96.0.10.53: 1923+ A? example.com.svc.cluster.local. (47)
20:18:49.225486 IP 10.244.2.3.60309 > 10.96.0.10.53: 4424+ AAAA? example.com.svc.cluster.local. (47)
20:18:49.225835 IP 10.96.0.10.53 > 10.244.2.3.60309: 4424 NXDomain*- 0/1/0 (140)
20:18:49.226020 IP 10.96.0.10.53 > 10.244.2.3.60309: 1923 NXDomain*- 0/1/0 (140)
20:18:49.226199 IP 10.244.2.3.42292 > 10.96.0.10.53: 4344+ A? example.com.cluster.local. (43)
20:18:49.226250 IP 10.244.2.3.42292 > 10.96.0.10.53: 5719+ AAAA? example.com.cluster.local. (43)
20:18:49.226520 IP 10.96.0.10.53 > 10.244.2.3.42292: 5719 NXDomain*- 0/1/0 (136)
20:18:49.226589 IP 10.96.0.10.53 > 10.244.2.3.42292: 4344 NXDomain*- 0/1/0 (136)
20:18:49.226645 IP 10.244.2.3.48428 > 10.96.0.10.53: 10557+ A? example.com.iitr.ac.in. (40)
20:18:49.226697 IP 10.244.2.3.48428 > 10.96.0.10.53: 11849+ AAAA? example.com.iitr.ac.in. (40)
20:18:49.226795 IP 10.96.0.10.53 > 10.244.2.3.48428: 11849* 0/1/0 (128)
20:18:49.226854 IP 10.96.0.10.53 > 10.244.2.3.48428: 10557* 0/1/0 (128)
20:18:50.244660 IP 10.244.2.3.56817 > 10.96.0.10.53: 29669+ A? example.com.default.svc.cluster.local. (55)
20:18:50.245170 IP 10.244.2.3.56817 > 10.96.0.10.53: 33461+ AAAA? example.com.default.svc.cluster.local. (55)
20:18:50.246404 IP 10.96.0.10.53 > 10.244.2.3.56817: 29669 NXDomain*- 0/1/0 (148)
20:18:50.246678 IP 10.96.0.10.53 > 10.244.2.3.56817: 33461 NXDomain*- 0/1/0 (148)
20:18:50.246915 IP 10.244.2.3.48944 > 10.96.0.10.53: 39236+ A? example.com.svc.cluster.local. (47)
20:18:50.247220 IP 10.244.2.3.48944 > 10.96.0.10.53: 41694+ AAAA? example.com.svc.cluster.local. (47)
20:18:50.247434 IP 10.96.0.10.53 > 10.244.2.3.48944: 39236 NXDomain*- 0/1/0 (140)
20:18:50.247615 IP 10.96.0.10.53 > 10.244.2.3.48944: 41694 NXDomain*- 0/1/0 (140)
20:18:50.247775 IP 10.244.2.3.54489 > 10.96.0.10.53: 63739+ A? example.com.cluster.local. (43)
20:18:50.247923 IP 10.244.2.3.54489 > 10.96.0.10.53: 328+ AAAA? example.com.cluster.local. (43)
20:18:50.248488 IP 10.96.0.10.53 > 10.244.2.3.54489: 328 NXDomain*- 0/1/0 (136)
20:18:50.248748 IP 10.96.0.10.53 > 10.244.2.3.54489: 63739 NXDomain*- 0/1/0 (136)
20:18:50.248868 IP 10.244.2.3.33462 > 10.96.0.10.53: 59311+ A? example.com.iitr.ac.in. (40)
20:18:50.248997 IP 10.244.2.3.33462 > 10.96.0.10.53: 61561+ AAAA? example.com.iitr.ac.in. (40)
20:18:50.249213 IP 10.96.0.10.53 > 10.244.2.3.33462: 59311* 0/1/0 (128)
20:18:50.249305 IP 10.96.0.10.53 > 10.244.2.3.33462: 61561* 0/1/0 (128)
20:18:51.265768 IP 10.244.2.3.40683 > 10.96.0.10.53: 5823+ A? example.com.default.svc.cluster.local. (55)
20:18:51.265874 IP 10.244.2.3.40683 > 10.96.0.10.53: 8115+ AAAA? example.com.default.svc.cluster.local. (55)
20:18:51.266920 IP 10.96.0.10.53 > 10.244.2.3.40683: 8115 NXDomain*- 0/1/0 (148)
20:18:51.268058 IP 10.96.0.10.53 > 10.244.2.3.40683: 5823 NXDomain*- 0/1/0 (148)
20:18:51.268232 IP 10.244.2.3.52813 > 10.96.0.10.53: 21785+ A? example.com.svc.cluster.local. (47)
20:18:51.268323 IP 10.244.2.3.52813 > 10.96.0.10.53: 23701+ AAAA? example.com.svc.cluster.local. (47)
20:18:51.268605 IP 10.96.0.10.53 > 10.244.2.3.52813: 23701 NXDomain*- 0/1/0 (140)
20:18:51.268652 IP 10.96.0.10.53 > 10.244.2.3.52813: 21785 NXDomain*- 0/1/0 (140)
20:18:51.268736 IP 10.244.2.3.35349 > 10.96.0.10.53: 28463+ A? example.com.cluster.local. (43)
20:18:51.268829 IP 10.244.2.3.35349 > 10.96.0.10.53: 30005+ AAAA? example.com.cluster.local. (43)
20:18:51.269531 IP 10.96.0.10.53 > 10.244.2.3.35349: 30005 NXDomain*- 0/1/0 (136)
20:18:51.269642 IP 10.96.0.10.53 > 10.244.2.3.35349: 28463 NXDomain*- 0/1/0 (136)
20:18:51.269732 IP 10.244.2.3.45760 > 10.96.0.10.53: 61765+ A? example.com.iitr.ac.in. (40)
20:18:51.269799 IP 10.244.2.3.45760 > 10.96.0.10.53: 64306+ AAAA? example.com.iitr.ac.in. (40)
20:18:51.269960 IP 10.96.0.10.53 > 10.244.2.3.45760: 64306* 0/1/0 (128)
20:18:51.270033 IP 10.96.0.10.53 > 10.244.2.3.45760: 61765* 0/1/0 (128)
20:18:52.284226 IP 10.244.2.3.38034 > 10.96.0.10.53: 49594+ A? example.com.default.svc.cluster.local. (55)
20:18:52.284474 IP 10.244.2.3.38034 > 10.96.0.10.53: 54177+ AAAA? example.com.default.svc.cluster.local. (55)
20:18:52.285204 IP 10.96.0.10.53 > 10.244.2.3.38034: 54177 NXDomain*- 0/1/0 (148)
20:18:52.285358 IP 10.96.0.10.53 > 10.244.2.3.38034: 49594 NXDomain*- 0/1/0 (148)
20:18:52.285470 IP 10.244.2.3.59462 > 10.96.0.10.53: 23289+ A? example.com.svc.cluster.local. (47)
20:18:52.285593 IP 10.244.2.3.59462 > 10.96.0.10.53: 25539+ AAAA? example.com.svc.cluster.local. (47)
20:18:52.286101 IP 10.96.0.10.53 > 10.244.2.3.59462: 23289 NXDomain*- 0/1/0 (140)
20:18:52.286234 IP 10.96.0.10.53 > 10.244.2.3.59462: 25539 NXDomain*- 0/1/0 (140)
20:18:52.286456 IP 10.244.2.3.35722 > 10.96.0.10.53: 3263+ A? example.com.cluster.local. (43)
20:18:52.286610 IP 10.244.2.3.35722 > 10.96.0.10.53: 6680+ AAAA? example.com.cluster.local. (43)
20:18:52.287058 IP 10.96.0.10.53 > 10.244.2.3.35722: 3263 NXDomain*- 0/1/0 (136)
20:18:52.287161 IP 10.96.0.10.53 > 10.244.2.3.35722: 6680 NXDomain*- 0/1/0 (136)
20:18:52.287286 IP 10.244.2.3.33757 > 10.96.0.10.53: 65385+ A? example.com.iitr.ac.in. (40)
20:18:52.287440 IP 10.244.2.3.33757 > 10.96.0.10.53: 3224+ AAAA? example.com.iitr.ac.in. (40)
20:18:52.287911 IP 10.96.0.10.53 > 10.244.2.3.33757: 65385* 0/1/0 (128)
20:18:52.288083 IP 10.96.0.10.53 > 10.244.2.3.33757: 3224* 0/1/0 (128)
20:18:53.293107 IP 10.244.2.3.43875 > 10.96.0.10.53: 61604+ A? example.com.default.svc.cluster.local. (55)
20:18:53.293287 IP 10.244.2.3.43875 > 10.96.0.10.53: 62937+ AAAA? example.com.default.svc.cluster.local. (55)
20:18:53.293568 IP 10.96.0.10.53 > 10.244.2.3.43875: 61604 NXDomain*- 0/1/0 (148)
20:18:53.293666 IP 10.96.0.10.53 > 10.244.2.3.43875: 62937 NXDomain*- 0/1/0 (148)
20:18:53.293714 IP 10.244.2.3.57170 > 10.96.0.10.53: 33587+ A? example.com.svc.cluster.local. (47)
20:18:53.293783 IP 10.244.2.3.57170 > 10.96.0.10.53: 34879+ AAAA? example.com.svc.cluster.local. (47)
20:18:53.293923 IP 10.96.0.10.53 > 10.244.2.3.57170: 34879 NXDomain*- 0/1/0 (140)
20:18:53.293989 IP 10.96.0.10.53 > 10.244.2.3.57170: 33587 NXDomain*- 0/1/0 (140)
20:18:53.294100 IP 10.244.2.3.38120 > 10.96.0.10.53: 32502+ A? example.com.cluster.local. (43)
20:18:53.294173 IP 10.244.2.3.38120 > 10.96.0.10.53: 33752+ AAAA? example.com.cluster.local. (43)
20:18:53.294434 IP 10.96.0.10.53 > 10.244.2.3.38120: 33752 NXDomain*- 0/1/0 (136)
20:18:53.295813 IP 10.96.0.10.53 > 10.244.2.3.38120: 32502 NXDomain*- 0/1/0 (136)
20:18:53.295880 IP 10.244.2.3.46108 > 10.96.0.10.53: 42641+ A? example.com.iitr.ac.in. (40)
20:18:53.295938 IP 10.244.2.3.46108 > 10.96.0.10.53: 43891+ AAAA? example.com.iitr.ac.in. (40)
20:18:53.296162 IP 10.96.0.10.53 > 10.244.2.3.46108: 43891* 0/1/0 (128)
20:18:53.296232 IP 10.96.0.10.53 > 10.244.2.3.46108: 42641* 0/1/0 (128)
20:18:54.301764 IP 10.244.2.3.46088 > 10.96.0.10.53: 21568+ A? example.com.default.svc.cluster.local. (55)
20:18:54.302072 IP 10.244.2.3.46088 > 10.96.0.10.53: 22859+ AAAA? example.com.default.svc.cluster.local. (55)
20:18:54.304331 IP 10.96.0.10.53 > 10.244.2.3.46088: 21568 NXDomain*- 0/1/0 (148)
20:18:54.305084 IP 10.96.0.10.53 > 10.244.2.3.46088: 22859 NXDomain*- 0/1/0 (148)
20:18:54.305314 IP 10.244.2.3.34713 > 10.96.0.10.53: 48094+ A? example.com.svc.cluster.local. (47)
20:18:54.305802 IP 10.244.2.3.34713 > 10.96.0.10.53: 50719+ AAAA? example.com.svc.cluster.local. (47)
20:18:54.306532 IP 10.96.0.10.53 > 10.244.2.3.34713: 48094 NXDomain*- 0/1/0 (140)
20:18:54.306862 IP 10.96.0.10.53 > 10.244.2.3.34713: 50719 NXDomain*- 0/1/0 (140)
20:18:54.307314 IP 10.244.2.3.36540 > 10.96.0.10.53: 12093+ A? example.com.cluster.local. (43)
20:18:54.307513 IP 10.244.2.3.36540 > 10.96.0.10.53: 14676+ AAAA? example.com.cluster.local. (43)
20:18:54.307805 IP 10.96.0.10.53 > 10.244.2.3.36540: 12093 NXDomain*- 0/1/0 (136)
20:18:54.308540 IP 10.96.0.10.53 > 10.244.2.3.36540: 14676 NXDomain*- 0/1/0 (136)
20:18:54.308638 IP 10.244.2.3.41242 > 10.96.0.10.53: 9983+ A? example.com.iitr.ac.in. (40)
20:18:54.308700 IP 10.244.2.3.41242 > 10.96.0.10.53: 11316+ AAAA? example.com.iitr.ac.in. (40)
20:18:54.309141 IP 10.96.0.10.53 > 10.244.2.3.41242: 11316* 0/1/0 (128)
20:18:54.309830 IP 10.96.0.10.53 > 10.244.2.3.41242: 9983* 0/1/0 (128)
20:18:55.321437 IP 10.244.2.3.56606 > 10.96.0.10.53: 14485+ A? example.com.default.svc.cluster.local. (55)
20:18:55.321809 IP 10.244.2.3.56606 > 10.96.0.10.53: 15985+ AAAA? example.com.default.svc.cluster.local. (55)
20:18:55.323246 IP 10.96.0.10.53 > 10.244.2.3.56606: 15985 NXDomain*- 0/1/0 (148)
20:18:55.323490 IP 10.96.0.10.53 > 10.244.2.3.56606: 14485 NXDomain*- 0/1/0 (148)
20:18:55.323617 IP 10.244.2.3.44993 > 10.96.0.10.53: 23420+ A? example.com.svc.cluster.local. (47)
20:18:55.323668 IP 10.244.2.3.44993 > 10.96.0.10.53: 24837+ AAAA? example.com.svc.cluster.local. (47)
20:18:55.324421 IP 10.96.0.10.53 > 10.244.2.3.44993: 23420 NXDomain*- 0/1/0 (140)
20:18:55.324487 IP 10.96.0.10.53 > 10.244.2.3.44993: 24837 NXDomain*- 0/1/0 (140)
20:18:55.324594 IP 10.244.2.3.42813 > 10.96.0.10.53: 9687+ A? example.com.cluster.local. (43)
20:18:55.324671 IP 10.244.2.3.42813 > 10.96.0.10.53: 10978+ AAAA? example.com.cluster.local. (43)
20:18:55.324868 IP 10.96.0.10.53 > 10.244.2.3.42813: 10978 NXDomain*- 0/1/0 (136)
20:18:55.324926 IP 10.96.0.10.53 > 10.244.2.3.42813: 9687 NXDomain*- 0/1/0 (136)
20:18:55.324991 IP 10.244.2.3.33132 > 10.96.0.10.53: 54852+ A? example.com.iitr.ac.in. (40)
20:18:55.325046 IP 10.244.2.3.33132 > 10.96.0.10.53: 56185+ AAAA? example.com.iitr.ac.in. (40)
20:18:55.325174 IP 10.96.0.10.53 > 10.244.2.3.33132: 54852* 0/1/0 (128)
20:18:55.328038 IP 10.96.0.10.53 > 10.244.2.3.33132: 56185* 0/1/0 (128)
20:18:56.336931 IP 10.244.2.3.37556 > 10.96.0.10.53: 30149+ A? example.com.default.svc.cluster.local. (55)
20:18:56.337137 IP 10.244.2.3.37556 > 10.96.0.10.53: 31649+ AAAA? example.com.default.svc.cluster.local. (55)
20:18:56.339903 IP 10.96.0.10.53 > 10.244.2.3.37556: 30149 NXDomain*- 0/1/0 (148)
20:18:56.344521 IP 10.96.0.10.53 > 10.244.2.3.37556: 31649 NXDomain*- 0/1/0 (148)
20:18:56.344608 IP 10.244.2.3.34918 > 10.96.0.10.53: 60762+ A? example.com.svc.cluster.local. (47)
20:18:56.344691 IP 10.244.2.3.34918 > 10.96.0.10.53: 62054+ AAAA? example.com.svc.cluster.local. (47)
20:18:56.345093 IP 10.96.0.10.53 > 10.244.2.3.34918: 60762 NXDomain*- 0/1/0 (140)
20:18:56.347410 IP 10.96.0.10.53 > 10.244.2.3.34918: 62054 NXDomain*- 0/1/0 (140)
20:18:56.347462 IP 10.244.2.3.46226 > 10.96.0.10.53: 44055+ A? example.com.cluster.local. (43)
20:18:56.347512 IP 10.244.2.3.46226 > 10.96.0.10.53: 45264+ AAAA? example.com.cluster.local. (43)
20:18:56.347623 IP 10.96.0.10.53 > 10.244.2.3.46226: 45264 NXDomain*- 0/1/0 (136)
20:18:56.350154 IP 10.96.0.10.53 > 10.244.2.3.46226: 44055 NXDomain*- 0/1/0 (136)
20:18:56.350214 IP 10.244.2.3.56550 > 10.96.0.10.53: 45044+ A? example.com.iitr.ac.in. (40)
20:18:56.350332 IP 10.244.2.3.56550 > 10.96.0.10.53: 46294+ AAAA? example.com.iitr.ac.in. (40)
20:18:56.350775 IP 10.96.0.10.53 > 10.244.2.3.56550: 46294* 0/1/0 (128)
20:18:56.350877 IP 10.96.0.10.53 > 10.244.2.3.56550: 45044* 0/1/0 (128)
20:18:57.364271 IP 10.244.2.3.57438 > 10.96.0.10.53: 8763+ A? example.com.default.svc.cluster.local. (55)
20:18:57.364593 IP 10.244.2.3.57438 > 10.96.0.10.53: 13721+ AAAA? example.com.default.svc.cluster.local. (55)
20:18:57.368892 IP 10.96.0.10.53 > 10.244.2.3.57438: 8763 NXDomain*- 0/1/0 (148)
20:18:57.369227 IP 10.96.0.10.53 > 10.244.2.3.57438: 13721 NXDomain*- 0/1/0 (148)
20:18:57.369400 IP 10.244.2.3.40254 > 10.96.0.10.53: 19949+ A? example.com.svc.cluster.local. (47)
20:18:57.369549 IP 10.244.2.3.40254 > 10.96.0.10.53: 22741+ AAAA? example.com.svc.cluster.local. (47)
20:18:57.369885 IP 10.96.0.10.53 > 10.244.2.3.40254: 22741 NXDomain*- 0/1/0 (140)
20:18:57.370080 IP 10.96.0.10.53 > 10.244.2.3.40254: 19949 NXDomain*- 0/1/0 (140)
20:18:57.370202 IP 10.244.2.3.35341 > 10.96.0.10.53: 8036+ A? example.com.cluster.local. (43)
20:18:57.370358 IP 10.244.2.3.35341 > 10.96.0.10.53: 10619+ AAAA? example.com.cluster.local. (43)
20:18:57.371047 IP 10.96.0.10.53 > 10.244.2.3.35341: 10619 NXDomain*- 0/1/0 (136)
20:18:57.371174 IP 10.96.0.10.53 > 10.244.2.3.35341: 8036 NXDomain*- 0/1/0 (136)
20:18:57.371358 IP 10.244.2.3.59336 > 10.96.0.10.53: 23649+ A? example.com.iitr.ac.in. (40)
20:18:57.371495 IP 10.244.2.3.59336 > 10.96.0.10.53: 26274+ AAAA? example.com.iitr.ac.in. (40)
20:18:57.371753 IP 10.96.0.10.53 > 10.244.2.3.59336: 26274* 0/1/0 (128)
20:18:57.371922 IP 10.96.0.10.53 > 10.244.2.3.59336: 23649* 0/1/0 (128)
20:18:58.380566 IP 10.244.2.3.55659 > 10.96.0.10.53: 33256+ A? example.com.default.svc.cluster.local. (55)
20:18:58.380697 IP 10.244.2.3.55659 > 10.96.0.10.53: 34548+ AAAA? example.com.default.svc.cluster.local. (55)
20:18:58.381010 IP 10.96.0.10.53 > 10.244.2.3.55659: 33256 NXDomain*- 0/1/0 (148)
20:18:58.381110 IP 10.96.0.10.53 > 10.244.2.3.55659: 34548 NXDomain*- 0/1/0 (148)
20:18:58.381179 IP 10.244.2.3.44417 > 10.96.0.10.53: 11448+ A? example.com.svc.cluster.local. (47)
20:18:58.381242 IP 10.244.2.3.44417 > 10.96.0.10.53: 12656+ AAAA? example.com.svc.cluster.local. (47)
20:18:58.381397 IP 10.96.0.10.53 > 10.244.2.3.44417: 11448 NXDomain*- 0/1/0 (140)
20:18:58.383823 IP 10.96.0.10.53 > 10.244.2.3.44417: 12656 NXDomain*- 0/1/0 (140)
20:18:58.383913 IP 10.244.2.3.58079 > 10.96.0.10.53: 62180+ A? example.com.cluster.local. (43)
20:18:58.384000 IP 10.244.2.3.58079 > 10.96.0.10.53: 63471+ AAAA? example.com.cluster.local. (43)
20:18:58.384195 IP 10.96.0.10.53 > 10.244.2.3.58079: 62180 NXDomain*- 0/1/0 (136)
20:18:58.386833 IP 10.96.0.10.53 > 10.244.2.3.58079: 63471 NXDomain*- 0/1/0 (136)
20:18:58.386884 IP 10.244.2.3.54003 > 10.96.0.10.53: 21778+ A? example.com.iitr.ac.in. (40)
20:18:58.386931 IP 10.244.2.3.54003 > 10.96.0.10.53: 23028+ AAAA? example.com.iitr.ac.in. (40)
20:18:58.387059 IP 10.96.0.10.53 > 10.244.2.3.54003: 23028* 0/1/0 (128)
20:18:58.387092 IP 10.96.0.10.53 > 10.244.2.3.54003: 21778* 0/1/0 (128)
20:18:59.394232 IP 10.244.2.3.60975 > 10.96.0.10.53: 53144+ A? example.com.default.svc.cluster.local. (55)
20:18:59.394361 IP 10.244.2.3.60975 > 10.96.0.10.53: 54477+ AAAA? example.com.default.svc.cluster.local. (55)
20:18:59.394733 IP 10.96.0.10.53 > 10.244.2.3.60975: 53144 NXDomain*- 0/1/0 (148)
20:18:59.394817 IP 10.96.0.10.53 > 10.244.2.3.60975: 54477 NXDomain*- 0/1/0 (148)
20:18:59.394846 IP 10.244.2.3.49852 > 10.96.0.10.53: 48669+ A? example.com.svc.cluster.local. (47)
20:18:59.394904 IP 10.244.2.3.49852 > 10.96.0.10.53: 49960+ AAAA? example.com.svc.cluster.local. (47)
20:18:59.395557 IP 10.96.0.10.53 > 10.244.2.3.49852: 48669 NXDomain*- 0/1/0 (140)
20:18:59.395613 IP 10.96.0.10.53 > 10.244.2.3.49852: 49960 NXDomain*- 0/1/0 (140)
20:18:59.395666 IP 10.244.2.3.58056 > 10.96.0.10.53: 19755+ A? example.com.cluster.local. (43)
20:18:59.395717 IP 10.244.2.3.58056 > 10.96.0.10.53: 21089+ AAAA? example.com.cluster.local. (43)
20:18:59.395939 IP 10.96.0.10.53 > 10.244.2.3.58056: 21089 NXDomain*- 0/1/0 (136)
20:18:59.396039 IP 10.96.0.10.53 > 10.244.2.3.58056: 19755 NXDomain*- 0/1/0 (136)
20:18:59.396102 IP 10.244.2.3.55268 > 10.96.0.10.53: 58212+ A? example.com.iitr.ac.in. (40)
20:18:59.396143 IP 10.244.2.3.55268 > 10.96.0.10.53: 59379+ AAAA? example.com.iitr.ac.in. (40)
20:18:59.396233 IP 10.96.0.10.53 > 10.244.2.3.55268: 59379* 0/1/0 (128)
20:18:59.396288 IP 10.96.0.10.53 > 10.244.2.3.55268: 58212* 0/1/0 (128)
20:19:00.503393 IP 10.244.2.3.42108 > 10.96.0.10.53: 8821+ A? example.com.default.svc.cluster.local. (55)
20:19:00.503728 IP 10.244.2.3.42108 > 10.96.0.10.53: 15904+ AAAA? example.com.default.svc.cluster.local. (55)
20:19:00.505616 IP 10.96.0.10.53 > 10.244.2.3.42108: 8821 NXDomain*- 0/1/0 (148)
20:19:00.508280 IP 10.96.0.10.53 > 10.244.2.3.42108: 15904 NXDomain*- 0/1/0 (148)
20:19:00.508566 IP 10.244.2.3.60461 > 10.96.0.10.53: 4568+ A? example.com.svc.cluster.local. (47)
20:19:00.508783 IP 10.244.2.3.60461 > 10.96.0.10.53: 6901+ AAAA? example.com.svc.cluster.local. (47)
20:19:00.509231 IP 10.96.0.10.53 > 10.244.2.3.60461: 6901 NXDomain*- 0/1/0 (140)
20:19:00.511018 IP 10.96.0.10.53 > 10.244.2.3.60461: 4568 NXDomain*- 0/1/0 (140)
20:19:00.511123 IP 10.244.2.3.44678 > 10.96.0.10.53: 49037+ A? example.com.cluster.local. (43)
20:19:00.511206 IP 10.244.2.3.44678 > 10.96.0.10.53: 50621+ AAAA? example.com.cluster.local. (43)
20:19:00.511356 IP 10.96.0.10.53 > 10.244.2.3.44678: 50621 NXDomain*- 0/1/0 (136)
20:19:00.513248 IP 10.96.0.10.53 > 10.244.2.3.44678: 49037 NXDomain*- 0/1/0 (136)
20:19:00.513328 IP 10.244.2.3.45472 > 10.96.0.10.53: 36556+ A? example.com.iitr.ac.in. (40)
20:19:00.513422 IP 10.244.2.3.45472 > 10.96.0.10.53: 37889+ AAAA? example.com.iitr.ac.in. (40)
20:19:00.513774 IP 10.96.0.10.53 > 10.244.2.3.45472: 36556* 0/1/0 (128)
20:19:00.513854 IP 10.96.0.10.53 > 10.244.2.3.45472: 37889* 0/1/0 (128)
20:19:01.518703 IP 10.244.2.3.46506 > 10.96.0.10.53: 17020+ A? example.com.default.svc.cluster.local. (55)
20:19:01.518819 IP 10.244.2.3.46506 > 10.96.0.10.53: 18520+ AAAA? example.com.default.svc.cluster.local. (55)
20:19:01.519211 IP 10.96.0.10.53 > 10.244.2.3.46506: 17020 NXDomain*- 0/1/0 (148)
20:19:01.520324 IP 10.96.0.10.53 > 10.244.2.3.46506: 18520 NXDomain*- 0/1/0 (148)
20:19:01.520393 IP 10.244.2.3.56959 > 10.96.0.10.53: 17235+ A? example.com.svc.cluster.local. (47)
20:19:01.520459 IP 10.244.2.3.56959 > 10.96.0.10.53: 18568+ AAAA? example.com.svc.cluster.local. (47)
20:19:01.520652 IP 10.96.0.10.53 > 10.244.2.3.56959: 18568 NXDomain*- 0/1/0 (140)
20:19:01.520722 IP 10.96.0.10.53 > 10.244.2.3.56959: 17235 NXDomain*- 0/1/0 (140)
