03:41:59.057926 IP 10.244.2.3.51273 > 10.96.0.10.53: 22545+ A? example.com.default.svc.cluster.local. (55)
03:41:59.058097 IP 10.244.2.3.51273 > 10.96.0.10.53: 23836+ AAAA? example.com.default.svc.cluster.local. (55)
03:41:59.058378 IP 10.96.0.10.53 > 10.244.2.3.51273: 22545 NXDomain*- 0/1/0 (148)
03:41:59.058424 IP 10.96.0.10.53 > 10.244.2.3.51273: 23836 NXDomain*- 0/1/0 (148)
03:41:59.058484 IP 10.244.2.3.55647 > 10.96.0.10.53: 520+ A? example.com.svc.cluster.local. (47)
03:41:59.058546 IP 10.244.2.3.55647 > 10.96.0.10.53: 1855+ AAAA? example.com.svc.cluster.local. (47)
03:41:59.058674 IP 10.96.0.10.53 > 10.244.2.3.55647: 1855 NXDomain*- 0/1/0 (140)
03:41:59.058714 IP 10.96.0.10.53 > 10.244.2.3.55647: 520 NXDomain*- 0/1/0 (140)
03:41:59.058770 IP 10.244.2.3.54229 > 10.96.0.10.53: 35173+ A? example.com.cluster.local. (43)
03:41:59.058843 IP 10.244.2.3.54229 > 10.96.0.10.53: 36340+ AAAA? example.com.cluster.local. (43)
03:41:59.059033 IP 10.96.0.10.53 > 10.244.2.3.54229: 36340 NXDomain*- 0/1/0 (136)
03:41:59.059076 IP 10.96.0.10.53 > 10.244.2.3.54229: 35173 NXDomain*- 0/1/0 (136)
03:41:59.059106 IP 10.244.2.3.43571 > 10.96.0.10.53: 45290+ A? example.com.iitr.ac.in. (40)
03:41:59.059151 IP 10.244.2.3.43571 > 10.96.0.10.53: 46581+ AAAA? example.com.iitr.ac.in. (40)
03:41:59.059255 IP 10.96.0.10.53 > 10.244.2.3.43571: 46581* 0/1/0 (128)
03:41:59.059296 IP 10.96.0.10.53 > 10.244.2.3.43571: 45290* 0/1/0 (128)
03:42:00.064669 IP 10.244.2.3.51123 > 10.96.0.10.53: 6399+ A? example.com.default.svc.cluster.local. (55)
03:42:00.064808 IP 10.244.2.3.51123 > 10.96.0.10.53: 7732+ AAAA? example.com.default.svc.cluster.local. (55)
03:42:00.065210 IP 10.96.0.10.53 > 10.244.2.3.51123: 7732 NXDomain*- 0/1/0 (148)
03:42:00.065512 IP 10.96.0.10.53 > 10.244.2.3.51123: 6399 NXDomain*- 0/1/0 (148)
03:42:00.065609 IP 10.244.2.3.33205 > 10.96.0.10.53: 58659+ A? example.com.svc.cluster.local. (47)
03:42:00.065745 IP 10.244.2.3.33205 > 10.96.0.10.53: 60159+ AAAA? example.com.svc.cluster.local. (47)
03:42:00.066097 IP 10.96.0.10.53 > 10.244.2.3.33205: 60159 NXDomain*- 0/1/0 (140)
03:42:00.066140 IP 10.96.0.10.53 > 10.244.2.3.33205: 58659 NXDomain*- 0/1/0 (140)
03:42:00.066166 IP 10.244.2.3.40025 > 10.96.0.10.53: 27427+ A? example.com.cluster.local. (43)
03:42:00.066213 IP 10.244.2.3.40025 > 10.96.0.10.53: 28885+ AAAA? example.com.cluster.local. (43)
03:42:00.066649 IP 10.96.0.10.53 > 10.244.2.3.40025: 27427 NXDomain*- 0/1/0 (136)
