08:45:01.883762 IP 10.244.2.3.54149 > 10.96.0.10.domain: 23722+ A? example.com.default.svc.cluster.local. (55)
08:45:01.884092 IP 10.244.2.3.54149 > 10.96.0.10.domain: 25722+ AAAA? example.com.default.svc.cluster.local. (55)
08:45:01.885080 IP 10.96.0.10.domain > 10.244.2.3.54149: 23722 NXDomain*- 0/1/0 (148)
08:45:01.885252 IP 10.96.0.10.domain > 10.244.2.3.54149: 25722 NXDomain*- 0/1/0 (148)
08:45:01.885341 IP 10.244.2.3.40088 > 10.96.0.10.domain: 58673+ A? example.com.svc.cluster.local. (47)
08:45:01.885445 IP 10.244.2.3.40088 > 10.96.0.10.domain: 60632+ AAAA? example.com.svc.cluster.local. (47)
08:45:01.885942 IP 10.96.0.10.domain > 10.244.2.3.40088: 60632 NXDomain*- 0/1/0 (140)
08:45:01.886274 IP 10.96.0.10.domain > 10.244.2.3.40088: 58673 NXDomain*- 0/1/0 (140)
08:45:01.886412 IP 10.244.2.3.42828 > 10.96.0.10.domain: 21537+ A? example.com.cluster.local. (43)
08:45:01.886767 IP 10.244.2.3.42828 > 10.96.0.10.domain: 23495+ AAAA? example.com.cluster.local. (43)
08:45:01.887233 IP 10.96.0.10.domain > 10.244.2.3.42828: 23495 NXDomain*- 0/1/0 (136)
08:45:01.887476 IP 10.96.0.10.domain > 10.244.2.3.42828: 21537 NXDomain*- 0/1/0 (136)
08:45:01.887563 IP 10.244.2.3.39184 > 10.96.0.10.domain: 53108+ A? example.com.iitr.ac.in. (40)
08:45:01.887706 IP 10.244.2.3.39184 > 10.96.0.10.domain: 54858+ AAAA? example.com.iitr.ac.in. (40)
08:45:01.887891 IP 10.96.0.10.domain > 10.244.2.3.39184: 54858* 0/1/0 (128)
08:45:01.888083 IP 10.96.0.10.domain > 10.244.2.3.39184: 53108* 0/1/0 (128)
08:45:02.894111 IP 10.244.2.3.59083 > 10.96.0.10.domain: 47359+ A? example.com.default.svc.cluster.local. (55)
08:45:02.894247 IP 10.244.2.3.59083 > 10.96.0.10.domain: 48650+ AAAA? example.com.default.svc.cluster.local. (55)
08:45:02.894531 IP 10.96.0.10.domain > 10.244.2.3.59083: 48650 NXDomain*- 0/1/0 (148)
08:45:02.894596 IP 10.96.0.10.domain > 10.244.2.3.59083: 47359 NXDomain*- 0/1/0 (148)
08:45:02.894646 IP 10.244.2.3.59690 > 10.96.0.10.domain: 10751+ A? example.com.svc.cluster.local. (47)
08:45:02.894705 IP 10.244.2.3.59690 > 10.96.0.10.domain: 12001+ AAAA? example.com.svc.cluster.local. (47)
08:45:02.894823 IP 10.96.0.10.domain > 10.244.2.3.59690: 10751 NXDomain*- 0/1/0 (140)
08:45:02.894872 IP 10.96.0.10.domain > 10.244.2.3.59690: 12001 NXDomain*- 0/1/0 (140)
08:45:02.894925 IP 10.244.2.3.39649 > 10.96.0.10.domain: 23445+ A? example.com.cluster.local. (43)
08:45:02.895002 IP 10.244.2.3.39649 > 10.96.0.10.domain: 24737+ AAAA? example.com.cluster.local. (43)
08:45:02.895245 IP 10.96.0.10.domain > 10.244.2.3.39649: 23445 NXDomain*- 0/1/0 (136)
08:45:02.895294 IP 10.96.0.10.domain > 10.244.2.3.39649: 24737 NXDomain*- 0/1/0 (136)
08:45:02.895339 IP 10.244.2.3.47090 > 10.96.0.10.domain: 49652+ A? example.com.iitr.ac.in. (40)
08:45:02.895407 IP 10.244.2.3.47090 > 10.96.0.10.domain: 51110+ AAAA? example.com.iitr.ac.in. (40)
08:45:02.895584 IP 10.96.0.10.domain > 10.244.2.3.47090: 51110* 0/1/0 (128)
08:45:02.895639 IP 10.96.0.10.domain > 10.244.2.3.47090: 49652* 0/1/0 (128)
08:45:03.911274 IP 10.244.2.3.50803 > 10.96.0.10.domain: 49509+ A? example.com.default.svc.cluster.local. (55)
08:45:03.911364 IP 10.244.2.3.50803 > 10.96.0.10.domain: 52676+ AAAA? example.com.default.svc.cluster.local. (55)
08:45:03.913377 IP 10.96.0.10.domain > 10.244.2.3.50803: 49509 NXDomain*- 0/1/0 (148)
08:45:03.913480 IP 10.96.0.10.domain > 10.244.2.3.50803: 52676 NXDomain*- 0/1/0 (148)
08:45:03.913614 IP 10.244.2.3.52681 > 10.96.0.10.domain: 62339+ A? example.com.svc.cluster.local. (47)
08:45:03.913843 IP 10.244.2.3.52681 > 10.96.0.10.domain: 553+ AAAA? example.com.svc.cluster.local. (47)
08:45:03.914218 IP 10.96.0.10.domain > 10.244.2.3.52681: 553 NXDomain*- 0/1/0 (140)
08:45:03.914433 IP 10.96.0.10.domain > 10.244.2.3.52681: 62339 NXDomain*- 0/1/0 (140)
08:45:03.914633 IP 10.244.2.3.55914 > 10.96.0.10.domain: 3570+ A? example.com.cluster.local. (43)
08:45:03.914810 IP 10.244.2.3.55914 > 10.96.0.10.domain: 16779+ AAAA? example.com.cluster.local. (43)
08:45:03.915164 IP 10.96.0.10.domain > 10.244.2.3.55914: 3570 NXDomain*- 0/1/0 (136)
08:45:03.915238 IP 10.96.0.10.domain > 10.244.2.3.55914: 16779 NXDomain*- 0/1/0 (136)
08:45:03.915362 IP 10.244.2.3.50853 > 10.96.0.10.domain: 24144+ A? example.com.iitr.ac.in. (40)
08:45:03.915511 IP 10.244.2.3.50853 > 10.96.0.10.domain: 26353+ AAAA? example.com.iitr.ac.in. (40)
08:45:03.925048 IP 10.96.0.10.domain > 10.244.2.3.50853: 24144 0/1/0 (128)
08:45:03.925153 IP 10.96.0.10.domain > 10.244.2.3.50853: 26353 0/1/0 (128)
08:45:04.933503 IP 10.244.2.3.48808 > 10.96.0.10.domain: 35443+ A? example.com.default.svc.cluster.local. (55)
08:45:04.933944 IP 10.244.2.3.48808 > 10.96.0.10.domain: 37943+ AAAA? example.com.default.svc.cluster.local. (55)
08:45:04.935060 IP 10.96.0.10.domain > 10.244.2.3.48808: 37943 NXDomain*- 0/1/0 (148)
08:45:04.935218 IP 10.96.0.10.domain > 10.244.2.3.48808: 35443 NXDomain*- 0/1/0 (148)
08:45:04.935364 IP 10.244.2.3.43047 > 10.96.0.10.domain: 17428+ A? example.com.svc.cluster.local. (47)
08:45:04.935607 IP 10.244.2.3.43047 > 10.96.0.10.domain: 37011+ AAAA? example.com.svc.cluster.local. (47)
08:45:04.936233 IP 10.96.0.10.domain > 10.244.2.3.43047: 37011 NXDomain*- 0/1/0 (140)
08:45:04.936346 IP 10.96.0.10.domain > 10.244.2.3.43047: 17428 NXDomain*- 0/1/0 (140)
08:45:04.936518 IP 10.244.2.3.53366 > 10.96.0.10.domain: 1797+ A? example.com.cluster.local. (43)
08:45:04.936600 IP 10.244.2.3.53366 > 10.96.0.10.domain: 4797+ AAAA? example.com.cluster.local. (43)
08:45:04.936842 IP 10.96.0.10.domain > 10.244.2.3.53366: 4797 NXDomain*- 0/1/0 (136)
08:45:04.937085 IP 10.96.0.10.domain > 10.244.2.3.53366: 1797 NXDomain*- 0/1/0 (136)
08:45:04.937181 IP 10.244.2.3.43801 > 10.96.0.10.domain: 13162+ A? example.com.iitr.ac.in. (40)
08:45:04.937298 IP 10.244.2.3.43801 > 10.96.0.10.domain: 14830+ AAAA? example.com.iitr.ac.in. (40)
08:45:04.937540 IP 10.96.0.10.domain > 10.244.2.3.43801: 13162* 0/1/0 (128)
08:45:04.937673 IP 10.96.0.10.domain > 10.244.2.3.43801: 14830* 0/1/0 (128)
08:45:05.945933 IP 10.244.2.3.33050 > 10.96.0.10.domain: 12049+ A? example.com.default.svc.cluster.local. (55)
08:45:05.946142 IP 10.244.2.3.33050 > 10.96.0.10.domain: 13674+ AAAA? example.com.default.svc.cluster.local. (55)
08:45:05.946616 IP 10.96.0.10.domain > 10.244.2.3.33050: 12049 NXDomain*- 0/1/0 (148)
08:45:05.947171 IP 10.96.0.10.domain > 10.244.2.3.33050: 13674 NXDomain*- 0/1/0 (148)
08:45:05.947270 IP 10.244.2.3.43893 > 10.96.0.10.domain: 64100+ A? example.com.svc.cluster.local. (47)
08:45:05.947333 IP 10.244.2.3.43893 > 10.96.0.10.domain: 23+ AAAA? example.com.svc.cluster.local. (47)
08:45:05.947548 IP 10.96.0.10.domain > 10.244.2.3.43893: 23 NXDomain*- 0/1/0 (140)
08:45:05.947613 IP 10.96.0.10.domain > 10.244.2.3.43893: 64100 NXDomain*- 0/1/0 (140)
08:45:05.947666 IP 10.244.2.3.43576 > 10.96.0.10.domain: 10188+ A? example.com.cluster.local. (43)
08:45:05.947718 IP 10.244.2.3.43576 > 10.96.0.10.domain: 11646+ AAAA? example.com.cluster.local. (43)
08:45:05.947888 IP 10.96.0.10.domain > 10.244.2.3.43576: 11646 NXDomain*- 0/1/0 (136)
08:45:05.947934 IP 10.96.0.10.domain > 10.244.2.3.43576: 10188 NXDomain*- 0/1/0 (136)
08:45:05.948101 IP 10.244.2.3.50735 > 10.96.0.10.domain: 57895+ A? example.com.iitr.ac.in. (40)
08:45:05.948163 IP 10.244.2.3.50735 > 10.96.0.10.domain: 59604+ AAAA? example.com.iitr.ac.in. (40)
08:45:05.948379 IP 10.96.0.10.domain > 10.244.2.3.50735: 57895* 0/1/0 (128)
08:45:05.948631 IP 10.96.0.10.domain > 10.244.2.3.50735: 59604* 0/1/0 (128)
08:45:06.953541 IP 10.244.2.3.44985 > 10.96.0.10.domain: 21574+ A? example.com.default.svc.cluster.local. (55)
08:45:06.953724 IP 10.244.2.3.44985 > 10.96.0.10.domain: 23282+ AAAA? example.com.default.svc.cluster.local. (55)
08:45:06.954205 IP 10.96.0.10.domain > 10.244.2.3.44985: 21574 NXDomain*- 0/1/0 (148)
08:45:06.954516 IP 10.96.0.10.domain > 10.244.2.3.44985: 23282 NXDomain*- 0/1/0 (148)
08:45:06.954580 IP 10.244.2.3.55133 > 10.96.0.10.domain: 44764+ A? example.com.svc.cluster.local. (47)
08:45:06.954624 IP 10.244.2.3.55133 > 10.96.0.10.domain: 46139+ AAAA? example.com.svc.cluster.local. (47)
08:45:06.954786 IP 10.96.0.10.domain > 10.244.2.3.55133: 46139 NXDomain*- 0/1/0 (140)
08:45:06.954827 IP 10.96.0.10.domain > 10.244.2.3.55133: 44764 NXDomain*- 0/1/0 (140)
08:45:06.954865 IP 10.244.2.3.57711 > 10.96.0.10.domain: 56957+ A? example.com.cluster.local. (43)
08:45:06.954927 IP 10.244.2.3.57711 > 10.96.0.10.domain: 58541+ AAAA? example.com.cluster.local. (43)
08:45:06.955146 IP 10.96.0.10.domain > 10.244.2.3.57711: 58541 NXDomain*- 0/1/0 (136)
08:45:06.955191 IP 10.96.0.10.domain > 10.244.2.3.57711: 56957 NXDomain*- 0/1/0 (136)
08:45:06.955241 IP 10.244.2.3.51125 > 10.96.0.10.domain: 51747+ A? example.com.iitr.ac.in. (40)
08:45:06.955274 IP 10.244.2.3.51125 > 10.96.0.10.domain: 53122+ AAAA? example.com.iitr.ac.in. (40)
08:45:06.955386 IP 10.96.0.10.domain > 10.244.2.3.51125: 53122* 0/1/0 (128)
08:45:06.955417 IP 10.96.0.10.domain > 10.244.2.3.51125: 51747* 0/1/0 (128)
08:45:07.962623 IP 10.244.2.3.50732 > 10.96.0.10.domain: 53703+ A? example.com.default.svc.cluster.local. (55)
08:45:07.962776 IP 10.244.2.3.50732 > 10.96.0.10.domain: 55161+ AAAA? example.com.default.svc.cluster.local. (55)
08:45:07.963346 IP 10.96.0.10.domain > 10.244.2.3.50732: 53703 NXDomain*- 0/1/0 (148)
08:45:07.963424 IP 10.96.0.10.domain > 10.244.2.3.50732: 55161 NXDomain*- 0/1/0 (148)
08:45:07.963504 IP 10.244.2.3.42676 > 10.96.0.10.domain: 40630+ A? example.com.svc.cluster.local. (47)
08:45:07.963558 IP 10.244.2.3.42676 > 10.96.0.10.domain: 41963+ AAAA? example.com.svc.cluster.local. (47)
08:45:07.963797 IP 10.96.0.10.domain > 10.244.2.3.42676: 41963 NXDomain*- 0/1/0 (140)
08:45:07.963872 IP 10.96.0.10.domain > 10.244.2.3.42676: 40630 NXDomain*- 0/1/0 (140)
08:45:07.963945 IP 10.244.2.3.36408 > 10.96.0.10.domain: 38718+ A? example.com.cluster.local. (43)
08:45:07.964085 IP 10.244.2.3.36408 > 10.96.0.10.domain: 40051+ AAAA? example.com.cluster.local. (43)
08:45:07.964200 IP 10.96.0.10.domain > 10.244.2.3.36408: 40051 NXDomain*- 0/1/0 (136)
08:45:07.964243 IP 10.96.0.10.domain > 10.244.2.3.36408: 38718 NXDomain*- 0/1/0 (136)
08:45:07.964299 IP 10.244.2.3.57142 > 10.96.0.10.domain: 61918+ A? example.com.iitr.ac.in. (40)
08:45:07.964348 IP 10.244.2.3.57142 > 10.96.0.10.domain: 63293+ AAAA? example.com.iitr.ac.in. (40)
08:45:07.964456 IP 10.96.0.10.domain > 10.244.2.3.57142: 63293* 0/1/0 (128)
08:45:07.964514 IP 10.96.0.10.domain > 10.244.2.3.57142: 61918* 0/1/0 (128)
08:45:08.971371 IP 10.244.2.3.50080 > 10.96.0.10.domain: 40888+ A? example.com.default.svc.cluster.local. (55)
08:45:08.971568 IP 10.244.2.3.50080 > 10.96.0.10.domain: 42305+ AAAA? example.com.default.svc.cluster.local. (55)
08:45:08.971960 IP 10.96.0.10.domain > 10.244.2.3.50080: 42305 NXDomain*- 0/1/0 (148)
08:45:08.972080 IP 10.96.0.10.domain > 10.244.2.3.50080: 40888 NXDomain*- 0/1/0 (148)
08:45:08.972130 IP 10.244.2.3.52218 > 10.96.0.10.domain: 35510+ A? example.com.svc.cluster.local. (47)
08:45:08.972194 IP 10.244.2.3.52218 > 10.96.0.10.domain: 36843+ AAAA? example.com.svc.cluster.local. (47)
08:45:08.972380 IP 10.96.0.10.domain > 10.244.2.3.52218: 35510 NXDomain*- 0/1/0 (140)
08:45:08.972686 IP 10.96.0.10.domain > 10.244.2.3.52218: 36843 NXDomain*- 0/1/0 (140)
08:45:08.972739 IP 10.244.2.3.46132 > 10.96.0.10.domain: 55403+ A? example.com.cluster.local. (43)
08:45:08.972785 IP 10.244.2.3.46132 > 10.96.0.10.domain: 56695+ AAAA? example.com.cluster.local. (43)
08:45:08.972906 IP 10.96.0.10.domain > 10.244.2.3.46132: 55403 NXDomain*- 0/1/0 (136)
08:45:08.972936 IP 10.96.0.10.domain > 10.244.2.3.46132: 56695 NXDomain*- 0/1/0 (136)
08:45:08.973000 IP 10.244.2.3.58253 > 10.96.0.10.domain: 56180+ A? example.com.iitr.ac.in. (40)
08:45:08.973063 IP 10.244.2.3.58253 > 10.96.0.10.domain: 57513+ AAAA? example.com.iitr.ac.in. (40)
08:45:08.973346 IP 10.96.0.10.domain > 10.244.2.3.58253: 56180* 0/1/0 (128)
08:45:08.973453 IP 10.96.0.10.domain > 10.244.2.3.58253: 57513* 0/1/0 (128)
08:45:09.977745 IP 10.244.2.3.39616 > 10.96.0.10.domain: 57244+ A? example.com.default.svc.cluster.local. (55)
08:45:09.977906 IP 10.244.2.3.39616 > 10.96.0.10.domain: 58619+ AAAA? example.com.default.svc.cluster.local. (55)
08:45:09.978283 IP 10.96.0.10.domain > 10.244.2.3.39616: 57244 NXDomain*- 0/1/0 (148)
08:45:09.978343 IP 10.96.0.10.domain > 10.244.2.3.39616: 58619 NXDomain*- 0/1/0 (148)
08:45:09.978431 IP 10.244.2.3.46272 > 10.96.0.10.domain: 28359+ A? example.com.svc.cluster.local. (47)
08:45:09.978489 IP 10.244.2.3.46272 > 10.96.0.10.domain: 29984+ AAAA? example.com.svc.cluster.local. (47)
08:45:09.978862 IP 10.96.0.10.domain > 10.244.2.3.46272: 28359 NXDomain*- 0/1/0 (140)
08:45:09.978934 IP 10.96.0.10.domain > 10.244.2.3.46272: 29984 NXDomain*- 0/1/0 (140)
08:45:09.979020 IP 10.244.2.3.58074 > 10.96.0.10.domain: 30419+ A? example.com.cluster.local. (43)
08:45:09.979088 IP 10.244.2.3.58074 > 10.96.0.10.domain: 32294+ AAAA? example.com.cluster.local. (43)
08:45:09.979277 IP 10.96.0.10.domain > 10.244.2.3.58074: 32294 NXDomain*- 0/1/0 (136)
08:45:09.979384 IP 10.96.0.10.domain > 10.244.2.3.58074: 30419 NXDomain*- 0/1/0 (136)
08:45:09.979519 IP 10.244.2.3.57666 > 10.96.0.10.domain: 18764+ A? example.com.iitr.ac.in. (40)
08:45:09.979600 IP 10.244.2.3.57666 > 10.96.0.10.domain: 20847+ AAAA? example.com.iitr.ac.in. (40)
08:45:09.980056 IP 10.96.0.10.domain > 10.244.2.3.57666: 20847* 0/1/0 (128)
08:45:09.980253 IP 10.96.0.10.domain > 10.244.2.3.57666: 18764* 0/1/0 (128)
08:45:10.987076 IP 10.244.2.3.57249 > 10.96.0.10.domain: 56399+ A? example.com.default.svc.cluster.local. (55)
08:45:10.987285 IP 10.244.2.3.57249 > 10.96.0.10.domain: 57858+ AAAA? example.com.default.svc.cluster.local. (55)
08:45:10.987895 IP 10.96.0.10.domain > 10.244.2.3.57249: 56399 NXDomain*- 0/1/0 (148)
08:45:10.988097 IP 10.96.0.10.domain > 10.244.2.3.57249: 57858 NXDomain*- 0/1/0 (148)
08:45:10.988175 IP 10.244.2.3.57372 > 10.96.0.10.domain: 6310+ A? example.com.svc.cluster.local. (47)
08:45:10.988266 IP 10.244.2.3.57372 > 10.96.0.10.domain: 7768+ AAAA? example.com.svc.cluster.local. (47)
08:45:10.988875 IP 10.96.0.10.domain > 10.244.2.3.57372: 6310 NXDomain*- 0/1/0 (140)
08:45:10.988955 IP 10.96.0.10.domain > 10.244.2.3.57372: 7768 NXDomain*- 0/1/0 (140)
08:45:10.989112 IP 10.244.2.3.43784 > 10.96.0.10.domain: 43488+ A? example.com.cluster.local. (43)
08:45:10.989184 IP 10.244.2.3.43784 > 10.96.0.10.domain: 44821+ AAAA? example.com.cluster.local. (43)
08:45:10.989340 IP 10.96.0.10.domain > 10.244.2.3.43784: 44821 NXDomain*- 0/1/0 (136)
08:45:10.989380 IP 10.96.0.10.domain > 10.244.2.3.43784: 43488 NXDomain*- 0/1/0 (136)
08:45:10.989424 IP 10.244.2.3.44642 > 10.96.0.10.domain: 7395+ A? example.com.iitr.ac.in. (40)
08:45:10.989492 IP 10.244.2.3.44642 > 10.96.0.10.domain: 8687+ AAAA? example.com.iitr.ac.in. (40)
08:45:10.989610 IP 10.96.0.10.domain > 10.244.2.3.44642: 8687* 0/1/0 (128)
08:45:10.989652 IP 10.96.0.10.domain > 10.244.2.3.44642: 7395* 0/1/0 (128)
08:45:11.995774 IP 10.244.2.3.47359 > 10.96.0.10.domain: 55870+ A? example.com.default.svc.cluster.local. (55)
08:45:11.995954 IP 10.244.2.3.47359 > 10.96.0.10.domain: 57786+ AAAA? example.com.default.svc.cluster.local. (55)
08:45:11.996649 IP 10.96.0.10.domain > 10.244.2.3.47359: 57786 NXDomain*- 0/1/0 (148)
08:45:11.996894 IP 10.96.0.10.domain > 10.244.2.3.47359: 55870 NXDomain*- 0/1/0 (148)
08:45:11.997152 IP 10.244.2.3.34391 > 10.96.0.10.domain: 7557+ A? example.com.svc.cluster.local. (47)
08:45:11.997202 IP 10.244.2.3.34391 > 10.96.0.10.domain: 9224+ AAAA? example.com.svc.cluster.local. (47)
08:45:11.997867 IP 10.96.0.10.domain > 10.244.2.3.34391: 9224 NXDomain*- 0/1/0 (140)
08:45:11.997946 IP 10.96.0.10.domain > 10.244.2.3.34391: 7557 NXDomain*- 0/1/0 (140)
08:45:11.998020 IP 10.244.2.3.38596 > 10.96.0.10.domain: 36186+ A? example.com.cluster.local. (43)
08:45:11.998087 IP 10.244.2.3.38596 > 10.96.0.10.domain: 38020+ AAAA? example.com.cluster.local. (43)
08:45:11.998261 IP 10.96.0.10.domain > 10.244.2.3.38596: 36186 NXDomain*- 0/1/0 (136)
08:45:11.998306 IP 10.96.0.10.domain > 10.244.2.3.38596: 38020 NXDomain*- 0/1/0 (136)
08:45:11.998353 IP 10.244.2.3.54195 > 10.96.0.10.domain: 43928+ A? example.com.iitr.ac.in. (40)
08:45:11.998416 IP 10.244.2.3.54195 > 10.96.0.10.domain: 45511+ AAAA? example.com.iitr.ac.in. (40)
08:45:11.998597 IP 10.96.0.10.domain > 10.244.2.3.54195: 43928* 0/1/0 (128)
08:45:11.998656 IP 10.96.0.10.domain > 10.244.2.3.54195: 45511* 0/1/0 (128)
08:45:13.003733 IP 10.244.2.3.50168 > 10.96.0.10.domain: 22540+ A? example.com.default.svc.cluster.local. (55)
08:45:13.003904 IP 10.244.2.3.50168 > 10.96.0.10.domain: 24499+ AAAA? example.com.default.svc.cluster.local. (55)
08:45:13.004370 IP 10.96.0.10.domain > 10.244.2.3.50168: 24499 NXDomain*- 0/1/0 (148)
08:45:13.004456 IP 10.96.0.10.domain > 10.244.2.3.50168: 22540 NXDomain*- 0/1/0 (148)
08:45:13.004591 IP 10.244.2.3.54220 > 10.96.0.10.domain: 37377+ A? example.com.svc.cluster.local. (47)
08:45:13.004676 IP 10.244.2.3.54220 > 10.96.0.10.domain: 38960+ AAAA? example.com.svc.cluster.local. (47)
08:45:13.005087 IP 10.96.0.10.domain > 10.244.2.3.54220: 38960 NXDomain*- 0/1/0 (140)
08:45:13.005184 IP 10.96.0.10.domain > 10.244.2.3.54220: 37377 NXDomain*- 0/1/0 (140)
08:45:13.005317 IP 10.244.2.3.41300 > 10.96.0.10.domain: 16242+ A? example.com.cluster.local. (43)
08:45:13.005358 IP 10.244.2.3.41300 > 10.96.0.10.domain: 17742+ AAAA? example.com.cluster.local. (43)
08:45:13.006219 IP 10.96.0.10.domain > 10.244.2.3.41300: 17742 NXDomain*- 0/1/0 (136)
08:45:13.006306 IP 10.96.0.10.domain > 10.244.2.3.41300: 16242 NXDomain*- 0/1/0 (136)
08:45:13.006451 IP 10.244.2.3.54699 > 10.96.0.10.domain: 10480+ A? example.com.iitr.ac.in. (40)
08:45:13.006499 IP 10.244.2.3.54699 > 10.96.0.10.domain: 13147+ AAAA? example.com.iitr.ac.in. (40)
08:45:13.006603 IP 10.96.0.10.domain > 10.244.2.3.54699: 13147* 0/1/0 (128)
08:45:13.006643 IP 10.96.0.10.domain > 10.244.2.3.54699: 10480* 0/1/0 (128)
08:45:14.013836 IP 10.244.2.3.51248 > 10.96.0.10.domain: 20817+ A? example.com.default.svc.cluster.local. (55)
08:45:14.014355 IP 10.244.2.3.51248 > 10.96.0.10.domain: 23984+ AAAA? example.com.default.svc.cluster.local. (55)
08:45:14.015110 IP 10.96.0.10.domain > 10.244.2.3.51248: 23984 NXDomain*- 0/1/0 (148)
08:45:14.015244 IP 10.96.0.10.domain > 10.244.2.3.51248: 20817 NXDomain*- 0/1/0 (148)
08:45:14.015429 IP 10.244.2.3.47034 > 10.96.0.10.domain: 3942+ A? example.com.svc.cluster.local. (47)
08:45:14.015504 IP 10.244.2.3.47034 > 10.96.0.10.domain: 7651+ AAAA? example.com.svc.cluster.local. (47)
08:45:14.015673 IP 10.96.0.10.domain > 10.244.2.3.47034: 7651 NXDomain*- 0/1/0 (140)
08:45:14.015791 IP 10.96.0.10.domain > 10.244.2.3.47034: 3942 NXDomain*- 0/1/0 (140)
08:45:14.015867 IP 10.244.2.3.37022 > 10.96.0.10.domain: 59274+ A? example.com.cluster.local. (43)
08:45:14.015945 IP 10.244.2.3.37022 > 10.96.0.10.domain: 60774+ AAAA? example.com.cluster.local. (43)
08:45:14.016217 IP 10.96.0.10.domain > 10.244.2.3.37022: 60774 NXDomain*- 0/1/0 (136)
08:45:14.016320 IP 10.96.0.10.domain > 10.244.2.3.37022: 59274 NXDomain*- 0/1/0 (136)
08:45:14.016368 IP 10.244.2.3.55115 > 10.96.0.10.domain: 35911+ A? example.com.iitr.ac.in. (40)
08:45:14.016431 IP 10.244.2.3.55115 > 10.96.0.10.domain: 37286+ AAAA? example.com.iitr.ac.in. (40)
08:45:14.016545 IP 10.96.0.10.domain > 10.244.2.3.55115: 37286* 0/1/0 (128)
08:45:14.016588 IP 10.96.0.10.domain > 10.244.2.3.55115: 35911* 0/1/0 (128)
08:45:15.022810 IP 10.244.2.3.38747 > 10.96.0.10.domain: 28148+ A? example.com.default.svc.cluster.local. (55)
08:45:15.022994 IP 10.244.2.3.38747 > 10.96.0.10.domain: 29815+ AAAA? example.com.default.svc.cluster.local. (55)
08:45:15.023280 IP 10.96.0.10.domain > 10.244.2.3.38747: 29815 NXDomain*- 0/1/0 (148)
08:45:15.023323 IP 10.96.0.10.domain > 10.244.2.3.38747: 28148 NXDomain*- 0/1/0 (148)
08:45:15.023370 IP 10.244.2.3.43376 > 10.96.0.10.domain: 25083+ A? example.com.svc.cluster.local. (47)
08:45:15.023439 IP 10.244.2.3.43376 > 10.96.0.10.domain: 26791+ AAAA? example.com.svc.cluster.local. (47)
08:45:15.023623 IP 10.96.0.10.domain > 10.244.2.3.43376: 26791 NXDomain*- 0/1/0 (140)
08:45:15.023671 IP 10.96.0.10.domain > 10.244.2.3.43376: 25083 NXDomain*- 0/1/0 (140)
08:45:15.023708 IP 10.244.2.3.42239 > 10.96.0.10.domain: 37450+ A? example.com.cluster.local. (43)
08:45:15.023766 IP 10.244.2.3.42239 > 10.96.0.10.domain: 38783+ AAAA? example.com.cluster.local. (43)
08:45:15.023891 IP 10.96.0.10.domain > 10.244.2.3.42239: 38783 NXDomain*- 0/1/0 (136)
08:45:15.023951 IP 10.96.0.10.domain > 10.244.2.3.42239: 37450 NXDomain*- 0/1/0 (136)
08:45:15.024108 IP 10.244.2.3.33528 > 10.96.0.10.domain: 42156+ A? example.com.iitr.ac.in. (40)
08:45:15.024158 IP 10.244.2.3.33528 > 10.96.0.10.domain: 43573+ AAAA? example.com.iitr.ac.in. (40)
08:45:15.024241 IP 10.96.0.10.domain > 10.244.2.3.33528: 43573* 0/1/0 (128)
08:45:15.024282 IP 10.96.0.10.domain > 10.244.2.3.33528: 42156* 0/1/0 (128)
08:45:16.029035 IP 10.244.2.3.58625 > 10.96.0.10.domain: 4198+ A? example.com.default.svc.cluster.local. (55)
08:45:16.029211 IP 10.244.2.3.58625 > 10.96.0.10.domain: 38198+ AAAA? example.com.default.svc.cluster.local. (55)
08:45:16.029553 IP 10.96.0.10.domain > 10.244.2.3.58625: 38198 NXDomain*- 0/1/0 (148)
08:45:16.029639 IP 10.96.0.10.domain > 10.244.2.3.58625: 4198 NXDomain*- 0/1/0 (148)
08:45:16.029708 IP 10.244.2.3.44594 > 10.96.0.10.domain: 60390+ A? example.com.svc.cluster.local. (47)
08:45:16.029755 IP 10.244.2.3.44594 > 10.96.0.10.domain: 61890+ AAAA? example.com.svc.cluster.local. (47)
08:45:16.030006 IP 10.96.0.10.domain > 10.244.2.3.44594: 61890 NXDomain*- 0/1/0 (140)
08:45:16.030084 IP 10.96.0.10.domain > 10.244.2.3.44594: 60390 NXDomain*- 0/1/0 (140)
08:45:16.030112 IP 10.244.2.3.58765 > 10.96.0.10.domain: 17687+ A? example.com.cluster.local. (43)
08:45:16.030182 IP 10.244.2.3.58765 > 10.96.0.10.domain: 19312+ AAAA? example.com.cluster.local. (43)
08:45:16.030344 IP 10.96.0.10.domain > 10.244.2.3.58765: 19312 NXDomain*- 0/1/0 (136)
08:45:16.030390 IP 10.96.0.10.domain > 10.244.2.3.58765: 17687 NXDomain*- 0/1/0 (136)
08:45:16.030451 IP 10.244.2.3.54539 > 10.96.0.10.domain: 29928+ A? example.com.iitr.ac.in. (40)
08:45:16.030488 IP 10.244.2.3.54539 > 10.96.0.10.domain: 31387+ AAAA? example.com.iitr.ac.in. (40)
08:45:16.030595 IP 10.96.0.10.domain > 10.244.2.3.54539: 29928* 0/1/0 (128)
08:45:16.030633 IP 10.96.0.10.domain > 10.244.2.3.54539: 31387* 0/1/0 (128)
08:45:17.034456 IP 10.244.2.3.37384 > 10.96.0.10.domain: 9961+ A? example.com.default.svc.cluster.local. (55)
08:45:17.034574 IP 10.244.2.3.37384 > 10.96.0.10.domain: 11252+ AAAA? example.com.default.svc.cluster.local. (55)
08:45:17.034796 IP 10.96.0.10.domain > 10.244.2.3.37384: 11252 NXDomain*- 0/1/0 (148)
08:45:17.034854 IP 10.96.0.10.domain > 10.244.2.3.37384: 9961 NXDomain*- 0/1/0 (148)
08:45:17.034917 IP 10.244.2.3.37613 > 10.96.0.10.domain: 39424+ A? example.com.svc.cluster.local. (47)
08:45:17.034980 IP 10.244.2.3.37613 > 10.96.0.10.domain: 40716+ AAAA? example.com.svc.cluster.local. (47)
08:45:17.035099 IP 10.96.0.10.domain > 10.244.2.3.37613: 40716 NXDomain*- 0/1/0 (140)
08:45:17.035170 IP 10.96.0.10.domain > 10.244.2.3.37613: 39424 NXDomain*- 0/1/0 (140)
08:45:17.035202 IP 10.244.2.3.59184 > 10.96.0.10.domain: 58576+ A? example.com.cluster.local. (43)
08:45:17.035268 IP 10.244.2.3.59184 > 10.96.0.10.domain: 60492+ AAAA? example.com.cluster.local. (43)
08:45:17.035403 IP 10.96.0.10.domain > 10.244.2.3.59184: 60492 NXDomain*- 0/1/0 (136)
08:45:17.035473 IP 10.96.0.10.domain > 10.244.2.3.59184: 58576 NXDomain*- 0/1/0 (136)
08:45:17.035499 IP 10.244.2.3.48018 > 10.96.0.10.domain: 31234+ A? example.com.iitr.ac.in. (40)
08:45:17.035548 IP 10.244.2.3.48018 > 10.96.0.10.domain: 32734+ AAAA? example.com.iitr.ac.in. (40)
08:45:17.035690 IP 10.96.0.10.domain > 10.244.2.3.48018: 31234* 0/1/0 (128)
08:45:17.036025 IP 10.96.0.10.domain > 10.244.2.3.48018: 32734* 0/1/0 (128)
08:45:18.042649 IP 10.244.2.3.55949 > 10.96.0.10.domain: 56538+ A? example.com.default.svc.cluster.local. (55)
08:45:18.042898 IP 10.244.2.3.55949 > 10.96.0.10.domain: 57954+ AAAA? example.com.default.svc.cluster.local. (55)
08:45:18.043303 IP 10.96.0.10.domain > 10.244.2.3.55949: 56538 NXDomain*- 0/1/0 (148)
08:45:18.043377 IP 10.96.0.10.domain > 10.244.2.3.55949: 57954 NXDomain*- 0/1/0 (148)
08:45:18.043435 IP 10.244.2.3.43431 > 10.96.0.10.domain: 31541+ A? example.com.svc.cluster.local. (47)
08:45:18.043494 IP 10.244.2.3.43431 > 10.96.0.10.domain: 32791+ AAAA? example.com.svc.cluster.local. (47)
08:45:18.043643 IP 10.96.0.10.domain > 10.244.2.3.43431: 32791 NXDomain*- 0/1/0 (140)
08:45:18.043694 IP 10.96.0.10.domain > 10.244.2.3.43431: 31541 NXDomain*- 0/1/0 (140)
08:45:18.043736 IP 10.244.2.3.41573 > 10.96.0.10.domain: 12199+ A? example.com.cluster.local. (43)
08:45:18.043783 IP 10.244.2.3.41573 > 10.96.0.10.domain: 13324+ AAAA? example.com.cluster.local. (43)
08:45:18.043960 IP 10.96.0.10.domain > 10.244.2.3.41573: 13324 NXDomain*- 0/1/0 (136)
08:45:18.044117 IP 10.96.0.10.domain > 10.244.2.3.41573: 12199 NXDomain*- 0/1/0 (136)
08:45:18.044168 IP 10.244.2.3.57141 > 10.96.0.10.domain: 43364+ A? example.com.iitr.ac.in. (40)
08:45:18.044206 IP 10.244.2.3.57141 > 10.96.0.10.domain: 44573+ AAAA? example.com.iitr.ac.in. (40)
08:45:18.044345 IP 10.96.0.10.domain > 10.244.2.3.57141: 43364* 0/1/0 (128)
08:45:18.044388 IP 10.96.0.10.domain > 10.244.2.3.57141: 44573* 0/1/0 (128)
08:45:18.225193 ARP, Request who-has 10.244.2.1 tell 10.244.2.3, length 28
08:45:18.225744 ARP, Reply 10.244.2.1 is-at 16:e4:c0:1f:97:55 (oui Unknown), length 28
08:45:19.054314 IP 10.244.2.3.57350 > 10.96.0.10.domain: 42801+ A? example.com.default.svc.cluster.local. (55)
08:45:19.056188 IP 10.244.2.3.57350 > 10.96.0.10.domain: 44510+ AAAA? example.com.default.svc.cluster.local. (55)
08:45:19.058207 IP 10.96.0.10.domain > 10.244.2.3.57350: 42801 NXDomain*- 0/1/0 (148)
08:45:19.060331 IP 10.96.0.10.domain > 10.244.2.3.57350: 44510 NXDomain*- 0/1/0 (148)
08:45:19.061089 IP 10.244.2.3.50493 > 10.96.0.10.domain: 13461+ A? example.com.svc.cluster.local. (47)
08:45:19.062129 IP 10.244.2.3.50493 > 10.96.0.10.domain: 16211+ AAAA? example.com.svc.cluster.local. (47)
08:45:19.063539 IP 10.96.0.10.domain > 10.244.2.3.50493: 16211 NXDomain*- 0/1/0 (140)
08:45:19.063865 IP 10.96.0.10.domain > 10.244.2.3.50493: 13461 NXDomain*- 0/1/0 (140)
08:45:19.064086 IP 10.244.2.3.51319 > 10.96.0.10.domain: 27100+ A? example.com.cluster.local. (43)
08:45:19.064551 IP 10.244.2.3.51319 > 10.96.0.10.domain: 28350+ AAAA? example.com.cluster.local. (43)
08:45:19.067233 IP 10.96.0.10.domain > 10.244.2.3.51319: 28350 NXDomain*- 0/1/0 (136)
08:45:19.070758 IP 10.96.0.10.domain > 10.244.2.3.51319: 27100 NXDomain*- 0/1/0 (136)
08:45:19.070904 IP 10.244.2.3.46046 > 10.96.0.10.domain: 29793+ A? example.com.iitr.ac.in. (40)
08:45:19.071049 IP 10.244.2.3.46046 > 10.96.0.10.domain: 31418+ AAAA? example.com.iitr.ac.in. (40)
08:45:19.071365 IP 10.96.0.10.domain > 10.244.2.3.46046: 29793* 0/1/0 (128)
08:45:19.072508 IP 10.96.0.10.domain > 10.244.2.3.46046: 31418* 0/1/0 (128)
08:45:20.088963 IP 10.244.2.3.50203 > 10.96.0.10.domain: 42544+ A? example.com.default.svc.cluster.local. (55)
08:45:20.089258 IP 10.244.2.3.50203 > 10.96.0.10.domain: 45127+ AAAA? example.com.default.svc.cluster.local. (55)
08:45:20.090011 IP 10.96.0.10.domain > 10.244.2.3.50203: 42544 NXDomain*- 0/1/0 (148)
08:45:20.090230 IP 10.96.0.10.domain > 10.244.2.3.50203: 45127 NXDomain*- 0/1/0 (148)
08:45:20.090433 IP 10.244.2.3.39269 > 10.96.0.10.domain: 53482+ A? example.com.svc.cluster.local. (47)
08:45:20.090585 IP 10.244.2.3.39269 > 10.96.0.10.domain: 56732+ AAAA? example.com.svc.cluster.local. (47)
08:45:20.091076 IP 10.96.0.10.domain > 10.244.2.3.39269: 53482 NXDomain*- 0/1/0 (140)
08:45:20.091226 IP 10.96.0.10.domain > 10.244.2.3.39269: 56732 NXDomain*- 0/1/0 (140)
08:45:20.091457 IP 10.244.2.3.48981 > 10.96.0.10.domain: 63089+ A? example.com.cluster.local. (43)
08:45:20.091535 IP 10.244.2.3.48981 > 10.96.0.10.domain: 11+ AAAA? example.com.cluster.local. (43)
08:45:20.091914 IP 10.96.0.10.domain > 10.244.2.3.48981: 63089 NXDomain*- 0/1/0 (136)
08:45:20.092316 IP 10.96.0.10.domain > 10.244.2.3.48981: 11 NXDomain*- 0/1/0 (136)
08:45:20.092465 IP 10.244.2.3.60012 > 10.96.0.10.domain: 65064+ A? example.com.iitr.ac.in. (40)
08:45:20.092574 IP 10.244.2.3.60012 > 10.96.0.10.domain: 2362+ AAAA? example.com.iitr.ac.in. (40)
08:45:20.092888 IP 10.96.0.10.domain > 10.244.2.3.60012: 2362* 0/1/0 (128)
08:45:20.093173 IP 10.96.0.10.domain > 10.244.2.3.60012: 65064* 0/1/0 (128)
08:45:21.100583 IP 10.244.2.3.46354 > 10.96.0.10.domain: 64891+ A? example.com.default.svc.cluster.local. (55)
08:45:21.100741 IP 10.244.2.3.46354 > 10.96.0.10.domain: 1438+ AAAA? example.com.default.svc.cluster.local. (55)
08:45:21.101193 IP 10.96.0.10.domain > 10.244.2.3.46354: 64891 NXDomain*- 0/1/0 (148)
08:45:21.101285 IP 10.96.0.10.domain > 10.244.2.3.46354: 1438 NXDomain*- 0/1/0 (148)
08:45:21.101361 IP 10.244.2.3.55131 > 10.96.0.10.domain: 23436+ A? example.com.svc.cluster.local. (47)
08:45:21.101438 IP 10.244.2.3.55131 > 10.96.0.10.domain: 25727+ AAAA? example.com.svc.cluster.local. (47)
08:45:21.101680 IP 10.96.0.10.domain > 10.244.2.3.55131: 25727 NXDomain*- 0/1/0 (140)
08:45:21.101754 IP 10.96.0.10.domain > 10.244.2.3.55131: 23436 NXDomain*- 0/1/0 (140)
08:45:21.101821 IP 10.244.2.3.51011 > 10.96.0.10.domain: 31357+ A? example.com.cluster.local. (43)
08:45:21.101878 IP 10.244.2.3.51011 > 10.96.0.10.domain: 33232+ AAAA? example.com.cluster.local. (43)
08:45:21.102744 IP 10.96.0.10.domain > 10.244.2.3.51011: 33232 NXDomain*- 0/1/0 (136)
08:45:21.103009 IP 10.96.0.10.domain > 10.244.2.3.51011: 31357 NXDomain*- 0/1/0 (136)
08:45:21.103225 IP 10.244.2.3.50088 > 10.96.0.10.domain: 59782+ A? example.com.iitr.ac.in. (40)
08:45:21.103351 IP 10.244.2.3.50088 > 10.96.0.10.domain: 62241+ AAAA? example.com.iitr.ac.in. (40)
08:45:21.103696 IP 10.96.0.10.domain > 10.244.2.3.50088: 62241* 0/1/0 (128)
08:45:21.103805 IP 10.96.0.10.domain > 10.244.2.3.50088: 59782* 0/1/0 (128)
08:45:22.112428 IP 10.244.2.3.34349 > 10.96.0.10.domain: 15473+ A? example.com.default.svc.cluster.local. (55)
08:45:22.112775 IP 10.244.2.3.34349 > 10.96.0.10.domain: 17098+ AAAA? example.com.default.svc.cluster.local. (55)
08:45:22.113678 IP 10.96.0.10.domain > 10.244.2.3.34349: 15473 NXDomain*- 0/1/0 (148)
08:45:22.113775 IP 10.96.0.10.domain > 10.244.2.3.34349: 17098 NXDomain*- 0/1/0 (148)
08:45:22.113844 IP 10.244.2.3.58703 > 10.96.0.10.domain: 54536+ A? example.com.svc.cluster.local. (47)
08:45:22.113949 IP 10.244.2.3.58703 > 10.96.0.10.domain: 55828+ AAAA? example.com.svc.cluster.local. (47)
08:45:22.114393 IP 10.96.0.10.domain > 10.244.2.3.58703: 54536 NXDomain*- 0/1/0 (140)
08:45:22.114452 IP 10.96.0.10.domain > 10.244.2.3.58703: 55828 NXDomain*- 0/1/0 (140)
08:45:22.114518 IP 10.244.2.3.38369 > 10.96.0.10.domain: 19776+ A? example.com.cluster.local. (43)
08:45:22.114576 IP 10.244.2.3.38369 > 10.96.0.10.domain: 21026+ AAAA? example.com.cluster.local. (43)
08:45:22.114756 IP 10.96.0.10.domain > 10.244.2.3.38369: 21026 NXDomain*- 0/1/0 (136)
08:45:22.114804 IP 10.96.0.10.domain > 10.244.2.3.38369: 19776 NXDomain*- 0/1/0 (136)
08:45:22.114834 IP 10.244.2.3.35681 > 10.96.0.10.domain: 63303+ A? example.com.iitr.ac.in. (40)
08:45:22.114890 IP 10.244.2.3.35681 > 10.96.0.10.domain: 64970+ AAAA? example.com.iitr.ac.in. (40)
08:45:22.115159 IP 10.96.0.10.domain > 10.244.2.3.35681: 64970* 0/1/0 (128)
08:45:22.115245 IP 10.96.0.10.domain > 10.244.2.3.35681: 63303* 0/1/0 (128)
08:45:23.120215 IP 10.244.2.3.43318 > 10.96.0.10.domain: 57225+ A? example.com.default.svc.cluster.local. (55)
08:45:23.120337 IP 10.244.2.3.43318 > 10.96.0.10.domain: 58767+ AAAA? example.com.default.svc.cluster.local. (55)
08:45:23.120576 IP 10.96.0.10.domain > 10.244.2.3.43318: 58767 NXDomain*- 0/1/0 (148)
08:45:23.120640 IP 10.96.0.10.domain > 10.244.2.3.43318: 57225 NXDomain*- 0/1/0 (148)
08:45:23.120713 IP 10.244.2.3.36654 > 10.96.0.10.domain: 43987+ A? example.com.svc.cluster.local. (47)
08:45:23.120780 IP 10.244.2.3.36654 > 10.96.0.10.domain: 45362+ AAAA? example.com.svc.cluster.local. (47)
08:45:23.121122 IP 10.96.0.10.domain > 10.244.2.3.36654: 45362 NXDomain*- 0/1/0 (140)
08:45:23.121193 IP 10.96.0.10.domain > 10.244.2.3.36654: 43987 NXDomain*- 0/1/0 (140)
08:45:23.121271 IP 10.244.2.3.60525 > 10.96.0.10.domain: 5630+ A? example.com.cluster.local. (43)
08:45:23.121322 IP 10.244.2.3.60525 > 10.96.0.10.domain: 7130+ AAAA? example.com.cluster.local. (43)
08:45:23.121792 IP 10.96.0.10.domain > 10.244.2.3.60525: 5630 NXDomain*- 0/1/0 (136)
08:45:23.121827 IP 10.96.0.10.domain > 10.244.2.3.60525: 7130 NXDomain*- 0/1/0 (136)
08:45:23.121879 IP 10.244.2.3.33160 > 10.96.0.10.domain: 32898+ A? example.com.iitr.ac.in. (40)
08:45:23.121939 IP 10.244.2.3.33160 > 10.96.0.10.domain: 34398+ AAAA? example.com.iitr.ac.in. (40)
08:45:23.122096 IP 10.96.0.10.domain > 10.244.2.3.33160: 34398* 0/1/0 (128)
08:45:23.122129 IP 10.96.0.10.domain > 10.244.2.3.33160: 32898* 0/1/0 (128)
08:45:24.126017 IP 10.244.2.3.60029 > 10.96.0.10.domain: 25027+ A? example.com.default.svc.cluster.local. (55)
08:45:24.126157 IP 10.244.2.3.60029 > 10.96.0.10.domain: 26402+ AAAA? example.com.default.svc.cluster.local. (55)
08:45:24.126470 IP 10.96.0.10.domain > 10.244.2.3.60029: 25027 NXDomain*- 0/1/0 (148)
08:45:24.126540 IP 10.96.0.10.domain > 10.244.2.3.60029: 26402 NXDomain*- 0/1/0 (148)
08:45:24.126598 IP 10.244.2.3.43514 > 10.96.0.10.domain: 26379+ A? example.com.svc.cluster.local. (47)
08:45:24.126665 IP 10.244.2.3.43514 > 10.96.0.10.domain: 28212+ AAAA? example.com.svc.cluster.local. (47)
08:45:24.126828 IP 10.96.0.10.domain > 10.244.2.3.43514: 26379 NXDomain*- 0/1/0 (140)
08:45:24.126866 IP 10.96.0.10.domain > 10.244.2.3.43514: 28212 NXDomain*- 0/1/0 (140)
08:45:24.126910 IP 10.244.2.3.50762 > 10.96.0.10.domain: 21662+ A? example.com.cluster.local. (43)
08:45:24.127013 IP 10.244.2.3.50762 > 10.96.0.10.domain: 22912+ AAAA? example.com.cluster.local. (43)
08:45:24.127237 IP 10.96.0.10.domain > 10.244.2.3.50762: 21662 NXDomain*- 0/1/0 (136)
08:45:24.127318 IP 10.96.0.10.domain > 10.244.2.3.50762: 22912 NXDomain*- 0/1/0 (136)
08:45:24.127361 IP 10.244.2.3.39374 > 10.96.0.10.domain: 14209+ A? example.com.iitr.ac.in. (40)
08:45:24.127408 IP 10.244.2.3.39374 > 10.96.0.10.domain: 15751+ AAAA? example.com.iitr.ac.in. (40)
08:45:24.127551 IP 10.96.0.10.domain > 10.244.2.3.39374: 14209* 0/1/0 (128)
08:45:24.127602 IP 10.96.0.10.domain > 10.244.2.3.39374: 15751* 0/1/0 (128)
08:45:25.132294 IP 10.244.2.3.59641 > 10.96.0.10.domain: 50453+ A? example.com.default.svc.cluster.local. (55)
08:45:25.132466 IP 10.244.2.3.59641 > 10.96.0.10.domain: 52869+ AAAA? example.com.default.svc.cluster.local. (55)
08:45:25.132879 IP 10.96.0.10.domain > 10.244.2.3.59641: 50453 NXDomain*- 0/1/0 (148)
08:45:25.132950 IP 10.96.0.10.domain > 10.244.2.3.59641: 52869 NXDomain*- 0/1/0 (148)
08:45:25.133086 IP 10.244.2.3.36298 > 10.96.0.10.domain: 5164+ A? example.com.svc.cluster.local. (47)
08:45:25.133213 IP 10.244.2.3.36298 > 10.96.0.10.domain: 8206+ AAAA? example.com.svc.cluster.local. (47)
08:45:25.133420 IP 10.96.0.10.domain > 10.244.2.3.36298: 8206 NXDomain*- 0/1/0 (140)
08:45:25.133525 IP 10.96.0.10.domain > 10.244.2.3.36298: 5164 NXDomain*- 0/1/0 (140)
08:45:25.133589 IP 10.244.2.3.46520 > 10.96.0.10.domain: 11051+ A? example.com.cluster.local. (43)
08:45:25.133672 IP 10.244.2.3.46520 > 10.96.0.10.domain: 13093+ AAAA? example.com.cluster.local. (43)
08:45:25.133846 IP 10.96.0.10.domain > 10.244.2.3.46520: 11051 NXDomain*- 0/1/0 (136)
08:45:25.134855 IP 10.96.0.10.domain > 10.244.2.3.46520: 13093 NXDomain*- 0/1/0 (136)
08:45:25.135073 IP 10.244.2.3.49080 > 10.96.0.10.domain: 50448+ A? example.com.iitr.ac.in. (40)
